title;price;original price;discount;stock;delivery
Lenyes CR136 Phone Holder 360 Non Slip Portable Black Garansi Original - Not Specified;58900;149000;60;766;Kota Tangerang
Somostel Baterai iPhone 7 / 7G;88000;88000;0;1;Kota Surabaya
RAPAtech DC5054 - LINE MAX PRO 4-in-1 Cable 60W - Apple MFi Certified - DC5054 MFi Only;749000;749000;0;774;Kota Administrasi Jakarta Barat
Somostel Baterai iPhone 8 Plus;110000;110000;0;1;Kota Surabaya
RAPAtech DC3034 - LINE+ I Apple MFi Certified USB-C to Lightning 27W - DC3034 1 Meter;199800;999000;80;795;Kota Administrasi Jakarta Barat
Somostel Baterai iPhone 8 / 8G;88000;88000;0;1;Kota Surabaya
RAPAtech DC4044 - LINE II - Apple MFi Certified USB-C to Lightning 27W - DC4044;169000;499000;66;800;Kota Administrasi Jakarta Barat
Kamus Elektronik Alfa Link EI - 21SE;460000;460000;0;9999;Jakarta Utara
Sesuai untuk(RealMe C17)kasus telepon,Komponen elektronik,bahan kaca tempered, anti drop, anti slip, wear-resistant - 1, Kesing RealMe C17;58000;58000;0;9;Kab. Tangerang
ELCO 33uf 250v elko 33uf 250v elektronik capacitor kapasitor;900;900;0;165;Jakarta Barat
Xiaomi Ebook Reader 6 Inci E-ink Layar E-Book untuk Elektronik Buku;2780910;2780910;0;1000;Kota Semarang
Somostel Baterai iPhone 6 Plus / 6+;110000;110000;0;1;Kota Surabaya
Apple battery pack [USED LIKE NEW];1600000;1600000;0;1;Kota Surabaya
Somostel Baterai Advan G5;71500;71500;0;1;Kota Surabaya
Krisbow Hand Dryer High Speed 900 watt Mini Mrd900 Mesin Pengering Tangan Hand Blower Peralatan Elektronik;1226600;1443000;15;4;Kab. Bekasi
Kalkulator Elektronik 12 Digit - KK-837B - Black;35000;35000;0;15;Kota Bandung
QA ELEKTRONIK HMD 46 pro;3850000;3850000;0;19;Kab. Tangerang
Solder Listrik Set 60 Watt Paket Solder Alat Servis Elektronik Lengkap Peralatan Soldier Listrik Hp - PAKET B;70000;70000;0;5;Jakarta Selatan
ABC Elektronik Official - Changhong 55QCN1 Qled 55 Inch Uhd 4k Google Smart Tv Hdr 10 Digital Tv;7931500;7931500;0;4;Kota Bandung
TRANSISTOR A102 Elektronik;3450;3450;0;7;Kota Tangerang
KATROL LISTRIK MINI ELEKTRONIK WIRE ROPE HOIST 600 kg WEKA;2500000;2500000;0;10;Jakarta Barat
Light Box Display Frame Poster LED Slim Round Edge EU Plug 40x60cm Iklan Poster Cafe Resto Toko Elektronik;800000;800000;0;3;Kota Bandung
CO Contact Cleaner C&C - Cairan Pembersih Elektronik Pelarut;95000;95000;0;3;Jakarta Utara
GUB Barfly Carbon Speedometer Braket perangkat Elektronik DI2 AXS EPS;175000;175000;0;4;Kab. Tegal
2PC 16A Saklar suhu otomatis ketel listrik / Pengatur suhu otomatis / Pengendali elektronik - 2PCS;10465;10465;0;0;Kota Administrasi Jakarta Utara
Kaki Bulat Ganjal Kursi Kotak Box Elektronik Transparan Isi 4 Pcs;10000;10000;0;749;Kab. Bandung
PHILIPS HID-PV C 35/ S CDM BALLAST ELEKTRONIK CDM - T 35 Watt;110000;110000;0;50;Kota Administrasi Jakarta Pusat
Ukuran Besar Rentang Digital Caliper Panjang Ukur Rahang Elektronik Vernier Caliper 0-300 Mm Outer Diameter Dalam Langkah Pengukuran;635200;635200;0;109;Jakarta Barat
Bestir 16Pcs Obeng Set Reparasi Elektronik;282700;282700;0;3;Jakarta Barat
Locker Lock RFID Card Electronic - Kunci Loker Elektronik Digital AC 10-07;264000;264000;0;5;Jakarta Utara
kit water level prakarya elektronik (No Solder) + Baterai 9V;22500;22500;0;182;Kab. Bekasi
Promo Power Supply Elektronik Cctv 12V-20amper Box;250000;250000;0;100000;Jakarta Barat
Satu Set Obeng Reparasi 45 in 1 Obeng Perbaikan Alat Elektronik;65000;65000;0;123;Kota Administrasi Jakarta Pusat
Solder iron Temperature 60W - CS-31 - service elektronik / hp;38700;38700;0;4999;Kota Administrasi Jakarta Barat
OBENG SEGITIGA SET 3 PCS SELLERY 11-903 TRIANGLE HEAD SCREWDRIVER / OBENG SERVIS SEGI TIGA MAINAN / ELEKTRONIK / UNIK - -, -;69999;69999;0;388;Kab. Bogor
TEKIRO - KUNCI L ELEKTRONIK 7 PCS 0.71 - 3 MM PER SET ORIGINAL GROSIR;24000;24000;0;99935;Kota Administrasi Jakarta Barat
Stetoskop Elektrik Elektronik, Digital Electronic Electric Stethoscope - Ear Phone;550000;550000;0;1;Kota Padang
lem silikon HC860C pelindung circuit elektronik receiver rc car ESC;49500;49500;0;38;Kota Administrasi Jakarta Barat
Thermal Paste Komputer PS GD900-1 30 Gram, Konduktivitas Termal Tinggi - Pendingin, Elektronik, Gray, Laptop - spatula;2000;2000;0;308;Kota Administrasi Jakarta Utara
Mesin Tinju Elektronik JLD dengan Target Dinding dan 6 Lampu - Boxing Alat;590000;1180000;50;1000;Kota Administrasi Jakarta Barat
Batrai CCTV PANEL SURYA Dan Baterai Alat Elektronik Lainnya 4X 18650 6000mAh 30A 3,7V 22,2Wh;120000;145000;17;1993;Kota Administrasi Jakarta Pusat
Batrai RC / Speaker Dan Alat Elektronik Lainnya 3X 18650 4800mAh 12V BMS 3S 10A SOKET JST PH 2.0 2 PIN;81000;96500;16;1987;Kota Administrasi Jakarta Pusat
cooling fan 5V 30x30mm 3cm 13200RPM fan esc kipas pendingin elektronik;26000;26000;0;10;Kab. Bekasi
Timbangan Badan Kaca Elektronik 180KG - SC-05 - Black - Hitam;79990;79990;0;10;Kota Cimahi
Box Komponen - Box Rakit Elektronik - Box X1 Lubang - Box X1 Lubang;3000;3000;0;9;Kota Administrasi Jakarta Barat
BTA16-600 BTA16-600D BTA16600 BTA16 600 TRIAC 40A 600V TO-220 Komponen Elektronik - BTA10-600;5500;5500;0;94;Kota Depok
Pembuatan Alat Otomasi Arduino IoT Proyek Automation Elektronik IoT;1000000;1000000;0;100000;Kota Bandung
Box Komponen - Box Rakit Elektronik - Box X1 Lubang - Box X1 Lubang;3000;3000;0;337;Kota Administrasi Jakarta Barat
Arieff Elektronik - Modul Tpa3118 32 Pin Mono Pbtl Power Amplifier 1X60W Tpa 3118 Class D Elantech;142000;142000;0;40;Jakarta Utara
Robot sumo elektronik board arduino nano  Motor driver - Include Driver;450000;450000;0;4;Kota Surabaya
Melodi Elektronik Store - Smsl Po100 Ak / Po100Ak / Po 100Ak Hi-Res Usb Digital Interface Dac;1839000;1839000;0;10;Kota Tangerang Selatan
STANDARD Contact Cleaner Lubricant CCL Pembersih Komponen Elektronik;35591;35591;0;4;Kota Semarang
Pasta Lem untuk menempelkan komponen listrik dan metal biasa digunakan untuk alat elektronik Mencegah Oksidasi 30 gr;9900;9900;0;485;Kota Tangerang Selatan
ECU elektronik control unit toyota kijang inova diesel 89661-0KV30;7500000;7500000;0;1;Jakarta Barat
BASID 2405 Jam Tangan Olahraga Pria Multifungsi Dial Besar Tahan Air Analog-Digital Elektronik LED Tahan Guncangan - Blue;157900;157900;0;197;Kab. Tangerang
Obeng Elektronik set 32 in 1 full Set Lengkap obeng Pinset Mini Kotak Alat Service Multifungsi;17100;18000;5;5;Kota Tangerang Selatan
BUKU ELEKTRONIK The Encyclopedia of Seasoning: 350 Marinades, Rubs, Glazes, Sauces, Bastes and Butters for Every Meal;43200;45000;4;48;Kota Administrasi Jakarta Selatan
BOX HITAN BOX PELASTIK BOX ELETRONIK BOX ELECTRONIC KOTAK ELEKTRONIK;12000;12000;0;15;Kota Bandung
Kartu Garansi & E-Card Membership EJG Elektronik - Dibawah 100.000;5000;5000;0;95;Kota Surabaya
AQUA Elektronik Smart Android TV AQT32K701A 32 Inch Android 11;1749000;1945000;10;42;Kota Administrasi Jakarta Utara
AQUA Elektronik LE58AQT6700UG Android TV Smart AI 58 Inch 4K;5018900;5018900;0;96;Kota Administrasi Jakarta Utara
AQUA Elektronik AQR-DTM285RAP(FB) Kulkas 2 Door 225L - Inverter -Turbo cooling - Black shine;3148900;4299000;27;36;Kota Administrasi Jakarta Utara
AC Midea 1/2 PK (0.5 PK) Standard - R32 Series - MSAFE-05CRN2;2849000;3799000;25;370;Kota Administrasi Jakarta Utara
"BRAKET / BRACKET / BREKET TV LED LCD 14"" - 32""";37500;37500;0;930;Kota Administrasi Jakarta Barat
BOX HITAN BOX PELASTIK BOX ELETRONIK BOX ELECTRONIC KOTAK ELEKTRONIK;12000;12000;0;15;Kota Bandung
Kartu Garansi & E-Card Membership EJG Elektronik - Dibawah 100.000;5000;5000;0;95;Kota Surabaya
( 1 pcs ) TEKNOX Baterai Alkaline AAAA / A4 / E96 / LR61 - Batre Stylus Elektronik dan Medis;20000;20000;0;393;Jakarta Barat
AQUA ELEKTRONIK LED SMART TV ANDROID AQT32K701A USB MOVIE HDMI HD - LE32AQT6600G;1945000;1945000;0;1;Kota Administrasi Jakarta Utara
AC Midea 1 PK Standard - R32 Series - MSAF-09CRN2;3249000;4299000;24;257;Kota Administrasi Jakarta Utara
Google TV CHiQ 43 inch Smart TV FHD Youtube Digital TV (L43G7P Pro);2969000;7999000;63;1241;Kab. Tangerang
MIDEA Kipas Sirkulasi / Circulation Fan MFG180R0APB - Adjustable Height and Aroma Diffuser;779000;889000;12;64;Kota Administrasi Jakarta Utara
TOSHIBA Dispenser Air Galon Atas RWF-W1917TN(K);1429000;2899000;51;263;Kota Administrasi Jakarta Utara
Klakson PANGGIL PENUMPANG TELOLET BASURI DOBEL TOA elektronik 24 v;875000;875000;0;137;Kab. Bekasi
Box Plastik Hitam 150x100x50mm Box Instrument Elektronik;30000;30000;0;158;Kab. Sleman
Mainan Drone Elektronik Model Burung Terbang 2.4GHz+Lampu LED Bisa;158900;158900;0;1200;Jakarta Pusat
Custom Order Komponen Elektronik ( Pesanan Khusus );175000;175000;0;91;Kab. Bandung
Krisbow Set 18 Pcs Baterai Alkaline Aa Battery Elektronik Bateray;107500;107500;0;55;Kota Bekasi
BUKU ELEKTRONIK How to Feed the World: The History and Future of Food;28800;30000;4;48;Kota Administrasi Jakarta Selatan
Obeng Set Reparasi Magnetic Screwdrivers Tool Smartphone Laptop Elektronik Precision - 32 IN 1;21900;21900;0;40;Kota Surabaya
Case Aksesori Elektronik Ringan R233 R234 Cover Magnetik R233 R234 HARGA PER1PCS - Transparan Polos, 1PCS;7499;7499;0;999;Kab. Cilacap
Midea Microwave Oven  Listrik Tombol 20 L - MMO20PZA-MMPFBK/MMO20PLA - MMO20PZA-MMPFBK;769000;1500000;49;180;Kota Administrasi Jakarta Utara
ANTENA TV DIGITAL TANAKA MODEL CAPUNG + 15m HIGH GAIN (INDOOR/OUTDOOR);67000;67000;0;75;Kota Administrasi Jakarta Barat
[ONLINE EXCLUSIVE] Midea Induction Cooker - C16-RTY1619-RD -FREE Panci;599000;999000;40;21;Kota Administrasi Jakarta Utara
Remot / Remote TV LCD LED utk LG Smart AKB73975733;11500;11500;0;492;Kota Administrasi Jakarta Barat
Midea Oven Listrik Tombol 10 L - MEO-10BDW - Hitam;249000;799000;69;1;Kota Administrasi Jakarta Utara
Portable UPS Power Station Flashfish P66 230Wh 62400mAh 300W Grey Orange Alat Elektronik;1295000;1295000;0;4;Kota Tangerang Selatan
TOP246GN SOP7 - Komponen Elektronik;21000;21000;0;99990;Kota Tangerang Selatan
HG OBENG SET 115 IN 1 SERVICE HANDPHONE LAPTOP HP ELEKTRONIK - MERAH;43650;45000;3;49;Kota Administrasi Jakarta Utara
Alkitab Elektronik 2.0.0 LAI;5000;5000;0;19;Kota Administrasi Jakarta Pusat
Kalkulator GTTTZEN CT-512 12 Digit / Calculator Check Dual 2 Power Alat Hitam Elektronik;21000;50000;58;139960;Kota Surabaya
AQUA AC Split Standard Turbo Cool 1 PK AQA-KCR9FQDL;2758900;2999000;8;40;Kota Administrasi Jakarta Utara
TOSHIBA Kulkas 2 Pintu GR-B22ISP Kapasitas 180L - Non Inverter;2899000;3999000;28;8;Kota Administrasi Jakarta Utara
"BRAKET / BREKET /BRACKET TV LED LCD 19"" - 55""";200000;200000;0;300;Kota Administrasi Jakarta Barat
CHiQ AC 1/2 PK STANDARD 05QB2 [INDOOR + OUTDOOR UNIT ONLY] R32;2618000;2999000;13;20;Kab. Tangerang
Kabel HDMI TO RCA 1.5M Jaring FULL HD;18000;18000;0;2572;Kota Administrasi Jakarta Barat
Ultramen - Uang Elektronik Kartu Flazz BCA Gen 2/ Emoney Mandiri - Flazz 1 Sisi;138000;138000;0;79;Jakarta Barat
ESP8266 ESP-10 SERIAL WIFI MODULE BOARD HIGH QUALITY SMART ELEKTRONIK;30000;30000;0;5;Kota Bandung
Nota Toko Elektronik, Listrik & Servis Elektronik 2 ply Rangkap;24700;24700;0;30951;Jakarta Utara
Jam Tangan Anak Motif Bulat Elektronik Nomor Merah 37mm - Fashion;9999;9999;0;996;Kab. Sidoarjo
Paket Usaha Alat Listrik / Usaha toko Listrik dan Elektronik/ Pemula - Paket 50 Juta;53250000;53250000;0;2;Kota Tangerang
TOSHIBA Dispenser Air Galon Bawah RWF-W2035UVBID(K) Hitam;2579000;3999000;36;34;Kota Administrasi Jakarta Utara
Jack RCA Male Baut;3000;3000;0;1287;Kota Administrasi Jakarta Barat
CHANGHONG LED Digital TV 32 Inch L32G5W;1349000;1549000;13;88;Kota Administrasi Jakarta Utara
Antena TV Digital Indoor Outdoor Antenna Booster DVB-T2 4k PX DA-6000 + Kabel 12 Meter;155000;155000;0;59;Kota Administrasi Jakarta Barat
Midea Kompor Induksi / Induction Cooker / Kompor Listrik - MIC221T0AGB - Gratis Panci - 120 Watt;599000;999000;40;20;Kota Administrasi Jakarta Utara
Custom E-Card uang elektronik - print UV Seri JUJUTSU KAISEN Kartu Putih - E-money, 1 SISI;65000;100000;35;500;Kota Administrasi Jakarta Selatan
Taffware Kit Solder 7in1 SIK-002 60W 220V Alat Solder Elektronik dengan 10 Aksesori Lengkap Cocok untuk Reparasi dan Belajar Elektronika;117000;117000;0;496;Kota Administrasi Jakarta Selatan
Kit Komponen Elektronik Mega 1900PCS Kapasitor Resistors LED Transisto;721090;721090;0;10;Jakarta Barat
Adaptor 12V 1A untuk CCTV atau elektronik lainnya;20000;20000;0;871;Jakarta Pusat
Timbangan Dapur Sf-400 Elektronik Kitchen Scale Digital - Putih;31395;41900;25;50;Kota Surabaya
Tas Penyimpanan Aksesori Elektronik Portabel Case Small Travel;299000;299000;0;11;Kota Tangerang
Kabel Aux Audio Video 1,5 Meter Male to 2 RCA Male Ujung Gold;50000;50000;0;300;Kota Administrasi Jakarta Barat
Changhong 43 Inch Android 11 Frameless Smart TV Digital L43G7N;2919000;2919000;0;62;Kab. Tangerang
Hafele Built-in Cooker Hood Hamburg Series - Penghisap Asap Dapur;2147250;3316900;35;2;Kota Bekasi
"BRAKET / BRACKET / BREKET TV LCD LED 70 65 60 55 50 49 43 37 23"" - 70""";100000;100000;0;497;Kota Administrasi Jakarta Barat
CHiQ Chest Freezer CCF 118DW [110 LITER];1968000;3999000;51;28;Kab. Tangerang
Ballast Travo Elektronik EB-C 136 Watt untuk Lampu Neon TL 36watt;59000;59000;0;902;Kota Administrasi Jakarta Pusat
ballast/trafo elektronik 20-60watt TRIDONIC;60000;60000;0;50;Jakarta Barat
Krisbow Set Obeng satu set elektronik Presisi 8 Pcs;145000;145000;0;8;Kota Bandung
WD40 WD 40 WD-40 CONTACT CLEANER / PEMBERSIH BARANG ELEKTRONIK 200ML;73500;73500;0;11104;Kota Surabaya
Travo Lampu Electronic Ballast Elektronik Halogen Philips 12v Bekas;26500;26500;0;8;Kab. Bandung Barat
ballast trafo elektronik philips HF-S 136 TL-D II;39500;39500;0;63;Kota Administrasi Jakarta Pusat
POP IT ELEKTRONIK Mainan Edukasi Anak Squishy Viral Push Bubble Game Pop It Nyala Musik Light LED Fidget Pop It Elektrik Quick - Mini Mario Red;8990;20000;55;10;Kota Surabaya
Mur M3 Nut 3mm screw Hexa Hex RC elektronik drone car Baud m3 3mm;300;300;0;1013;Kab. Bekasi
Packing Bubble Wrap Tambahan untuk elektronik size kecil-sedang;5150;5150;0;9721;Kota Administrasi Jakarta Utara
Remot / Remote TV LCD LED utk Smart Android C-HONGL32H4;27000;27000;0;1000;Kota Administrasi Jakarta Barat
Google TV Changhong 55 inch Smart TV 4K UHD HDR10+DBX Dolby U55G7N PRO;5269000;5269000;0;78;Kab. Tangerang
JACK / JEK RCA GOLD BUNTUT GOLD / EMAS STRIP MERAH HITAM;4000;4000;0;4657;Kota Administrasi Jakarta Barat
TOSHIBA Dispenser Air Galon Bawah RWF-W1830UVBN(T) Brown Silver;3639000;4499000;19;48;Kota Administrasi Jakarta Utara
"Braket TV LED Gantung / Ceiling VESA 400X400 26"" - 60"" Tipe 076-2";200000;200000;0;20;Kota Administrasi Jakarta Barat
Kulkas Sharp 2 Pintu SJ195 MNHS SJ 195 Tanpa Bunga Es Sinar Sakti Elektronik Dinoyo Malang;2800000;2800000;0;5;Kota Malang
Raket Elektronik Pembasmi Nyamuk/Serangga;31350;31350;0;1;Kab. Klaten
BIOTA Smart Wall Socket EU / Universal - Colokan Kabel Tembok Untuk Semua Elektronik persegi panjang stop kontak meja - White;199000;199000;0;2;Kota Administrasi Jakarta Barat
Baterai Speaker /Baterai Alat Elektronik Lainnya 4X 18650 4000mAh 7,4V BMS 3S 10A SOKET XH;118725;135500;12;1998;Kota Administrasi Jakarta Pusat
Oranye LCD Smart Crane Timbangan Gantung Digital Elektronik 300 KG  LCD Electronic Hanging Scale - Oranye 300kg;219000;439000;50;4;Kab. Tangerang
Krisbow Mesin Absensi Elektronik Nt-86 / mesin absen / mesin recorder;1899900;2049900;7;2;Kota Bandung
"KAP/RUMAH LAMPU TL T8 18/20W SIMBAT BALAS ELEKTRONIK ""SIVITECH"" MURAH";45000;45000;0;999;Jakarta Utara
KITC Kartu Elektronik E Toll Meme Series - E-Money, Copy Paste;150000;200000;25;1;Kota Bandung
50kg Elektronik LCD Digital Skala Saku Bagasi Gantung Skala Koper Perjalanan Skala Berat Portabel;49633;102458;52;227;Kab. Tangerang
ELEKTRONIK MEDIA PLAYER & SET TOP BOX GOOGLE CHROMECAST 2 NEW;192000;192000;0;21;Jakarta Barat
Alat Pengusir Anti Tikus Nyamuk Kecoa Lalat Ultra Sonic Elektronik;370000;370000;0;67;Jakarta Barat
Casing remote honda freed komplit tombol dll tanpa elektronik nya;65000;65000;0;14;Kota Bandung
Mainan Pop It Elektronik Elektronic Quick Push Fidget Toys Challenge Mainan Keluarga Viral - Kuromi;41000;41000;0;1;Kota Palembang
OPTICAL EDGE FINDER ELEKTRONIK PRESISI LED & SENSOR Dengan alat CNC BIP LED;163000;300000;46;1000;Kota Administrasi Jakarta Barat
AZKO Philips Hair Dryer 400 watt Hp8108 - Pink Alat Pengering Rambut Hair Styler Elektronik Kecantikan;251910;279900;10;1;Kota Administrasi Jakarta Pusat
Forward FW-HA02 Hot Air Station - Alat Solder & Desolder Profesional - Alat Reparasi Elektronik Profesional Dengan LCD Display;1400820;1400820;0;7;Kota Tangerang
Tape Tembaga Copper Tape Foil Jalur Elektronik - 3mm;1650;1650;0;92;Kota Tangerang
Timbangan Gantung 50KG Weiheng WH-A08 Digital Elektronik Portable;27000;27000;0;994;Kota Administrasi Jakarta Utara
Fly Kipas 360º Pengusir Lalat Serangga Nyamuk Elektronik Repellent Fan;46999;46999;0;2667;Kota Administrasi Jakarta Utara
Nota Toko Elektronik 2 Ply 1/4 Folio - Siap Kirim;4700;4700;0;51596;Kota Administrasi Jakarta Utara
Batere Bateray Kotak 9V Doublepow Battery untuk Mainan Elektronik;13999;19999;30;1;Kota Tangerang Selatan
Elektronik Exceed Grip Pro Authentic 100%;498000;498000;0;141;Kota Bekasi
INSTRUMENTASI ELEKTRONIK DAN TEKNIL PENGUKURAN by WILLIAM COOPER.;65000;65000;0;8;Jakarta Pusat
Delay Timer Microwave Oven Elektronik 2 Pin 60 Menit Type Dkj-60 Ac-15 Terbaru;119000;119000;0;944;Kota Surabaya
Philips Electronic Transformer ET-E 10watt Trafo Elektronik 12Volt AC;45000;45000;0;200;Jakarta Barat
contact cleaner/penetran oil/electrical/perawatan elektronik/pelumas;35000;35000;0;148;Kab. Bekasi
Melodi Elektronik Store - Tangzu X Hbb Xuannv / Xuan Nv 2 Dynamic Driver Earphone In Ear Monitor;1909000;1909000;0;125;Kota Tangerang Selatan
ZKTECO Floor Standing Digital Signage ZK-DS43F Layar Interaktif Standar 43 Inci Kiosk Modern untuk Bisnis;9000000;24000000;63;13;Kota Administrasi Jakarta Barat
"BRAKET / BREKET / BRACKET TV LCD LED 23"" - 60"" JUMBO KOKOH";100000;100000;0;200;Kota Administrasi Jakarta Barat
TOSHIBA SingleDoor GR-RD196CC-DMF[37] Kulkas 1 Pintu Kapasitas 151L;1999000;2699000;26;23;Kota Administrasi Jakarta Utara
Jack / Jek / Connector RCA Bentuk H;1650;1650;0;401;Kota Administrasi Jakarta Barat
GME ANTENNA 120CM  AUSTRLALIA PROMO TOPED;2400000;2400000;0;14;Kota Medan
Thermis AC Panasonic Untuk Indoor Ac Panasonic Best Produk - AC;63987;63987;0;5;Kota Surabaya
Remot / Remote pengganti kompatibel utk TV LED LG Tipe AKB75735604 - Polos Non Merk;12000;12000;0;999;Kota Administrasi Jakarta Barat
Changhong 40 Inch Newest Android 11 Frameless Smart TV Digital L40G7N;2689000;4599000;42;353;Kab. Tangerang
Jack / Jek / Connector TV T Besi Drat;2000;2000;0;1825;Kota Administrasi Jakarta Barat
Remote AC Seri A75C4624 Panasonic Real ORIGINAL;128500;128500;0;9;Kota Surabaya
Ataru True Wireless Bluetooth Earphone Tws T37 - Hitam alat pengeras suara portable perlengkapan elektronik speaker nirkabelheadset;149900;349900;57;4;Kota Administrasi Jakarta Barat
Kabel Ekstensi 30 Meter 1.5mm - Kabel Panjang Listrik untuk Perangkat Elektronik, Sambungan Kabel Outdoor & Indoor - 5M;47313;47313;0;41;Kota Administrasi Jakarta Barat
Tabung Vakum Elektronik JJ Electronics Tesla ECC83-S/12AX7 Quad 4 bh;3788000;3788000;0;1;Kota Bandung
SW-200D Saklar Sudut Miring Tilt Elektronik Dengan Sensor Getaran;5000;5000;0;78;Kab. Cirebon
Sesuai untuk(iPhone X)kasus telepon,Komponen elektronik,bahan kaca tempered, anti drop, anti slip, wear-resistant - 1, iPhone X;58000;58000;0;9;Kab. Tangerang
Kabel RCA to RCA 2-2 / 2 ke 2 Audio 1.2 Meter - Murah;5000;5000;0;1239;Kota Administrasi Jakarta Barat
Changhong 43 Inch Newest Android 11 Frameless Smart TV Digital L43G7N;2919000;5599000;48;1871;Kab. Tangerang
Antena TV Digital Indoor Outdoor Antenna Booster DVB-T2 4K PX DA-6600 + Kabel 12 Meter;155000;155000;0;20;Kota Administrasi Jakarta Barat
Changhong Google TV 43 inch FHD Dolby Audio Google Play Smart TV Digital TV (L43M91);2929000;7799000;62;6;Kab. Tangerang
Jack RCA Female Cewe Baut;3000;3000;0;1930;Kota Administrasi Jakarta Barat
[Mizan] Buku Electronics Appliances Mengenal Alat Elektronik Boardbook;35000;79000;56;63;Kota Depok
Baterai Mainan RC, Elektronik 3X 18650 3S 12V 20A 4500mAh HITAM &MERAH;75000;75000;0;40;Kota Administrasi Jakarta Pusat
Obeng Set Multi 31 in 1 MINI Lengkap Serbaguna Handphone Elektronik HP;12150;12150;0;22;Kota Surabaya
Tongkat E-Toll Tongkat Kartu Elektronik E-Money GTO Tongtol E-Toll - Random;1700;1700;0;23;Kota Administrasi Jakarta Utara
Modul Detektor Metal Elektronik DC 3V-5V 60mm Non-Contact DIY;53470;53470;0;997;Jakarta Utara
Kap elektronik 15w  kap lampu housing T8 15w;60000;60000;0;48;Jakarta Barat
AZKO Krisbow Lampu Sorot Led 200 watt Cool Daylight Ip65 - Hitam Floodlight Ceiling Light Peralatan Elektronik Lampu Plafon;699500;1399000;50;1;Kota Administrasi Jakarta Barat
Stik Pelampung Pancing Elektronik Dengan Lampu LED Tega Baterai;68600;68600;0;41;Kota Administrasi Jakarta Timur
Mini UPS 12V 2A dengan Output Port DC 5.5×2.1 mm - Solusi Daya Cadangan & Proteksi Optimal untuk Perangkat Elektronik, CCTV, Router, dan Alarm;73161;73900;1;263;Kota Administrasi Jakarta Barat
Google TV CHiQ 32 inch Smart TV HDR10 Youtube Digital TV (L32G7P Pro);1999000;4999000;60;861;Kab. Tangerang
Remot / Remote DVD CRYSTAL KRISTAL Panjang;12000;12000;0;498;Kota Administrasi Jakarta Barat
Google TV Changhong Smart TV 75 Inch 4K UHD Digital LED TV U75F8T-PRO;12499000;12499000;0;99;Kab. Tangerang
e-Money SHIO TIKUS Shinchan Oriental Series Special Limited Edition eToll eMoney Mandiri NFC Kartu Elektronik Poster Cetakan Poster Card;59896;86923;31;10;Kota Depok
Pompa Pembersih Debu Camera, Computer, & Alat Elektronik lainnya;22000;22000;0;19;Jakarta Barat
Samsung Kabel Power AC Original 1.5 Meter SNI & EAC untuk TV PS2 PS3 PS4 Printer Adaptor Radio Elektronik;15000;15000;0;157;Kota Surabaya
Kabel Power PC/Komputer/CPU/Printer/UPS/Power Supply/LCD/Monitor NYK Pc Elektronik - black;14500;14500;0;172;Kota Administrasi Jakarta Barat
Mystery Box Barang Elektronik;250000;250000;0;967;Jakarta Utara
Wilenca Speaker Pengusir Tikus Ultrasonic /Rumah Elektronik Anti Nyamuk/ Kelelawar /Lalat Pest Repeller - Black;115000;115000;0;44;Kota Depok
Audio Player Fiio F9 Elektronik;5000000;5000000;0;100000;Jakarta Timur
Remot / Remote TV Sharp tabung;6500;6500;0;1964;Kota Administrasi Jakarta Barat
Remot / Remote TV  LCD LED  Plasma Pengganti utk merk SMG AA59-00602a - Non Merk;12500;12500;0;4982;Kota Administrasi Jakarta Barat
Remot STB SET TOP BOX LUBY 01 02 03 / ADVANCE / PIOLINE / WELHOME;10000;10000;0;4991;Kota Administrasi Jakarta Barat
JACK / JEK RCA GOLD BUNTUT FEMALE CEWE STRIP MERAH HITAM;6800;6800;0;284;Kota Administrasi Jakarta Barat
Toolset Elektronik Solder 12 in 1 Paket Lengkap Tool Set Solder - Antel 40 Watt;143200;143200;0;9;Jakarta Barat
Box project kotak box Hitam X3 X4 X5 X6 tempat rakit DIY elektronik - buble tambahan, X3;9000;9000;0;29;Kota Semarang
Obeng Mini buat jam hp rc elektronik dll plus atau minus kembang Murah;1450;1450;0;30;Jakarta Timur
Digital Voltmeter Mini 4-30V 3 kabel LED Merah Tester Elektronik;13000;13000;0;93;Kota Administrasi Jakarta Barat
4946B - SI4946BEY SOP8 - Komponen Elektronik;16000;16000;0;99996;Kota Tangerang Selatan
BATERAI UNIVERSAL ELEKTRONIK 401015 UKURAN 10mm x 15mm 170mah KABEL 2 MANTUL;18000;18000;0;99991;Kota Administrasi Jakarta Barat
Switch saklar Parkir EPB Elektronik Brake hold Honda CRV original;777250;777250;0;5;Jakarta Barat
Tool Kit Set S5 S-5 Murah Lengkap CADIK Pertukangan Elektronik;450000;450000;0;74;Kota Surabaya
Timah Solder Wire 0.8mm 100gram Tenol Elektronik Solder Tin 100G;25000;25000;0;538;Kota Administrasi Jakarta Pusat
Timbangan Badan Kaca Elektronik 180KG;53950;53950;0;86;Kota Surakarta
Obeng Hp Obeng elektronik Obeng Reparasi torx 25 in 1 Iphone dan Hp to;30000;30000;0;996;Kota Semarang
ELEKTRONIK SPEAKER EL~ SPEKER MEETING ASATRON WIRELLESS HT 8877 UKM;720000;720000;0;6;Jakarta Pusat
Lap Microfiber Kain Pembersih Pengering Kendaraan Elektronik Serap;4200;4200;0;1;Kota Administrasi Jakarta Timur
TRAFO BALLAST ELEKTRONIK TL 1X40 40W 40WATT 40 W TL-D GOOD QUALITY;25000;25000;0;850;Kota Administrasi Jakarta Pusat
Obeng Reparasi 25 in 1 Obeng HP Kacamata Laptop PC Elektronik;25000;25000;0;91;Kota Tangerang
Tindak Pidana Penipuan Berbasis Transaksi Elektronik;109000;109000;0;99993;Kab. Bogor
Transistor C945 Spare Part Electronic ORI Komponen Elektronik Asli;3000;3000;0;100;Kota Administrasi Jakarta Barat
SL99 Contact Cleaner 220gr Pembersih Komponen Elektronik Non Conductiv;39000;80000;51;478;Kota Administrasi Jakarta Timur
BTS Meal McD Melting - Uang Elektronik Kartu Flazz BCA Gen 2/ Emoney - Flazz 1 Sisi;138000;138000;0;16;Jakarta Barat
Baterai Speaker Dan Elektronik Lainnya 1X 18650 6800mAh 3,7V SOKET JST PH 2.0 2 PIN;25500;34500;26;2902;Kota Administrasi Jakarta Pusat
Elektronik / CHEST FREEZER TOSHIBA 200 liter CR 258 i garansi resmi 5 tahun;2995000;2995000;0;50;Jakarta Barat
Eps honda brio coloum stir dinamo modul satya 1.200cc L12 elektronik power steering;4000000;4000000;0;1;Jakarta Barat
Obeng Set 31in1 / 31 ini 1 Screwdriver Handphone Elektronik HP;34900;34900;0;9;Jakarta Selatan
LANGKA UNIK ANTIK 100 LEBIH KEYCARD KUNCI KARTU ELEKTRONIK HOTEL;303800;303800;0;200;Jakarta Utara
YASNA WIJAYA PLASTIK SAMPUL MAP F4 SAMPUL SERTIPIKAT ELEKTRONIK BPN map sertifikat tanah hard cover - Hijau;13000;13000;0;9;Kota Bandung
HEATSINK ALUMUNIUM PENDINGIN ELEKTRONIK HPL 6CMX7.8CM;48000;48000;0;1;Kota Bekasi
Svi cloud Android tv box. Produk terbaru dari svicloud - 9S, Keyboard I8;1850000;1850000;0;32;Jakarta Barat
Svicloud TV Box Android TV & Google TV - 9S, Keyboard I8;1850000;1850000;0;10;Kota Administrasi Jakarta Barat
Lenyes CR136 Phone Holder 360 Non Slip Portable Black Garansi Original - Not Specified;58900;149000;60;766;Kota Tangerang
Somostel Baterai iPhone 7 / 7G;88000;88000;0;1;Kota Surabaya
Somostel Baterai iPhone 7 / 7G;88000;88000;0;1;Kota Surabaya
RAPAtech DC5054 - LINE MAX PRO 4-in-1 Cable 60W - Apple MFi Certified - DC5054 MFi Only;749000;749000;0;774;Kota Administrasi Jakarta Barat
