title;price;original price;discount;stock;delivery
Converter RCA To Hdmi / coverter AV2HDMI / rca to hdmi converter;39000;39000;0;781;Jakarta Pusat
GREE AIR CURTAIN 120cm - FM-1.25-12-K;3409000;3409000;0;792;Kota Administrasi Jakarta Barat
KIPAS DC 5V 12V 24V 4CM 5CM 6CM 7CM 8CM 9CM 4X4 5X5 6X6 7X7 8X8 9X9 - 40x40x10mm, 12V;11700;11700;0;363;Kab. Sukoharjo
"Exhaust Fan Dinding KDK 12 "" inch - 30RQN5 30RQN 30 RQN 5";472000;472000;0;20;Jakarta Barat
100 pcs Baut JP M4x6 baut elektronik kepala bulat panjang 6mm - Kepala bulat/JP;6800;6800;0;95;Kota Surabaya
Pembersih Elektrik & Elektronik - REXCO 18 Contact Cleaner 500 ML;48300;48300;0;55;Kota Yogyakarta
Timer Microwave oven elektronik 2 pin 120 menit (WTA-3002B-120);69000;69000;0;467;Jakarta Barat
lem epoxy cor komponen elektronik - Putih, 1 kg set;147000;147000;0;83;Jakarta Timur
igoods.rose Whack-a-Mole Game Edukasi Anak Pop it Mainan Asah Otak  Pencetan Elektronik Mirip Pop It Fast Push Mainan edukasi anak;16900;26900;37;1;Kota Tangerang
SS Ssd Floppy Emulator Keyboard Elektronik (3 display);450000;450000;0;1;Kota Administrasi Jakarta Barat
Rust Stop RS-5.3  /Anti karat elektronik Mobil;3950000;3950000;0;50;Jakarta Barat
Mainan Anak Tamagotchi Hewan Peliharaan Virtual Elektronik 168 In 1 - Rumah Ungu;19000;19000;0;500;Jakarta Utara
Box custom akrilik project elektronik/Box amplifier/Bok arduino - metode lem;1000;1000;0;9;Kab. Tegal
CCL - Perfects Contact Cleaner - Pembersih Elektronik dll - Standard;40000;40000;0;8;Kota Denpasar
Kunci Obeng Screwdriver Set 115 in 1 Reparasi Smartphone Laptop Elektronik Mini Precision Tools Service Magnetic;65000;95000;32;31;Kota Semarang
DIY KIT Music Box 16Suara Sirine Bell KIT Belajar Elektronik Menyolder - sudah di rakit;35000;35000;0;42;Kota Bekasi
balast trafo elektronik philips 18 watt 1x18;29000;29000;0;385;Jakarta Pusat
Beli 1 Gratis 1 Jam Tangan Olahraga untuk Pria Jam Tangan Elektronik Tahan Air/Stopwatch/Tampilan Tanggal Minggu/Jam Alarm Waterproof - hitam;79000;112857;30;89;Kota Administrasi Jakarta Barat
AQUA Elektronik Mesin Cuci Top Loading 9 Kg AQW-98DD;3082000;3161000;2;2;Kota Administrasi Jakarta Utara
ONEMED Timbangan Dapur Digital EK 2260 - Timbangan Dapur Elektronik;130000;130000;0;8;Kota Surabaya
Alat Pengukur Daya Listrik Watt Ampere Alat Elektronik Power Meter;115000;115000;0;51;Kota Surabaya
ID-COOLING IS-55 ARGB Low Profile CPU Cooler (Intel/AMD) Fan Elektronik Led;619400;619400;0;6;Kota Surabaya
GST52 Contact Cleaner Pembersih Komponen Elektronik Pembersih Elektrik;24750;25000;1;9975;Kota Depok
10pcs Rubber Feet 3M Sticker Karet Kaki Alat Elektronik Laptop Bumper - Trapezoid 10*4mm;17000;17000;0;88;Kota Administrasi Jakarta Timur
KUNCI L ELEKTRONIK TEKIRO 7PCS HEX KEY ELECTRO SET 7PC 0.71-3mm;24500;24500;0;48;Kota Administrasi Jakarta Barat
Kipas Pendingin Perangkat Elektronik Cooling Fan Chassis Cabinet 100-240V EU with Knob - 1 Fan;84000;120000;30;99;Kota Administrasi Jakarta Barat
Eps toyota calya sigra 1.200cc elektronik power steering;4000000;4000000;0;2;Jakarta Barat
Kipas Fan DC 12V 9x9 CM Pendingin Elektronik - Not Specified;15000;15000;0;99;Kota Bandung
box metal enclosure 272x138x213mm box project elektronik power suppply box PCB;180000;180000;0;81;Kab. Sleman
PRIMO BLUE Electronic Contact Cleaner & Degreaser Pembersih Elektronik;34000;34000;0;12;Jakarta Selatan
AQUA Elektronik AQR-CTD506RGC(MB) Kulkas 4 Door 406L - Inverter - Metal door;8499000;9669000;12;2;Kota Administrasi Jakarta Utara
Set Drum Elektronik / Drum elektronik suara eksternal portabel Bluetooth / Set Drum Gulung Anak-anak - Drum Set;589000;854000;31;13;Kab. Tangerang
Pinset Elektronik High Pinset Anti Static Tweezers Suit 3 PCS JM-T11;29900;29900;0;5733;Kota Bandung
Ok Ac Elektronik Portabel Untuk Mobil 12V Dapat Disesuaikan Mobil 60W;2500000;2500000;0;100;Jakarta Selatan
Steker Lampu Steker Arde Saklar On Off Listrik Colokan Elektronik SNI - Steker Arde;9000;9000;0;1;Jakarta Selatan
iFixit Pro Tech Toolkit, untuk Laptop, Smartphone & Elektronik lainnya;1999000;1999000;0;2;Kota Administrasi Jakarta Barat
Timah Solder 0.8mm 50gram 50g Tenol Elektronik - 50GRAM - 50 Gram;12000;12000;0;877;Kota Administrasi Jakarta Pusat
AQUA Elektronik AQA-KCR9VRAL AC 1 PK Inverter UV Cool Wifi Control | With UVC Sterillization;4515000;4515000;0;99;Kota Administrasi Jakarta Utara
AQUA Elektronik Smart Android TV LE43AQT6700FG 43 Inch - Android 11 - LE43AQT6700FG;2949000;3737000;21;343;Kota Administrasi Jakarta Utara
AQUA Elektronik AQR-DTM285RAP(FB) Kulkas 2 Door 225L - Inverter -Turbo cooling - Black shine;3198900;4299000;26;49;Kota Administrasi Jakarta Utara
AQUA Elektronik 4K HDR Google TV 50 Inch AQT50K800UX;4699000;5670000;17;5;Kota Administrasi Jakarta Utara
AQUA Elektronik 4K HDR Google TV 50 Inch AQT50K800UX;4699000;5670000;17;5;Kota Administrasi Jakarta Utara
Packing Kayu Produk Elektronik TV AIOPC Monitor;200000;200000;0;69;Kota Administrasi Jakarta Utara
AQUA ELEKTRONIK TV Android LE43AQT6700FG Smart TV 43 inch;3304000;3304000;0;2;Kota Administrasi Jakarta Utara
AQUA Elektronik LE58AQT6700UG Android TV Smart AI 58 Inch 4K;5349000;6830000;22;117;Kota Administrasi Jakarta Utara
Timer Microwave oven elektronik 2 pin 120 menit (WTA-3002B-120) - TIMER SAJA;71000;71000;0;169;Kab. Tangerang
KAOS TEKNISI CCTV ELEKTRONIK DONE / TSHIRT BAJU PRIA KEREN - Hitam, S;60000;60000;0;93;Kab. Bogor
baterai cr2 battery rangefinder elektronik gadget kamera camera senter;19000;19000;0;33;Kota Surabaya
TERLARIS !! silica gell BLUE isi 100 sachet sillica gel BIRU camera baju sepatu silica pengawet elektronik silika - -, -;17000;18000;6;1;Kab. Tangerang
Pembersih komponen elektronik contact cleaner rexco18 rexco 18 220ML;28000;28000;0;42;Kota Administrasi Jakarta Barat
AQUA Elektronik 4K HDR Google TV 55 Inch AQT55K800UX;5799000;10299000;44;4;Kota Administrasi Jakarta Utara
Snake Cable LK Elektronik 6 Chenel 2 Output SN-001 15 Meter;990000;990000;0;15;Jakarta Pusat
AQUA Elektronik Google TV 65inch HQLED AQT65P750UX;10999000;10999000;0;5;Kota Administrasi Jakarta Utara
SMEG CJF01 Citrus Juicer - Pemeras Jeruk Elektronik - White;4150000;4150000;0;16;Jakarta Barat
Tone control stereo plus meddle ne5532 mitra sound modul elektronik original - Ic Ne5532 Std;45500;55500;18;99;Jakarta Barat
Perangkap Tikus Elektronik Perangkap Tikus Elektronik Profesional - Hitam;785000;785000;0;16;Jakarta Barat
Varistor 5D471K (komponen pelindung arus peralatan elektronik);2500;2500;0;91;Jakarta Timur
5/10/20 mtr Kabel Ekstensi 1.5 mm Cable Extension Sambungan Kabel Perlengkapan Perangkat Elektronik Electrical Tools Aluminium - 5M;40990;81980;50;793;Kab. Tangerang
SKMEI 1816 Jam Tangan Elektronik Luminous LED Light World Time Waterpr - Hitam;194400;194400;0;50;Kota Administrasi Jakarta Barat
Keyboard Discipad - Komponen elektronik BOM;140000;140000;0;7;Jakarta Barat
POP IT ELEKTRONIK Mainan Edukasi Anak Squishy Viral Push Bubble Game - Mini Dinosaurus;8990;40000;78;4;Kab. Tangerang
Box X2 - Box Plastik Elektronik X 2  Panjang;6500;6500;0;99772;Kota Tangerang
AZKO Krisbow Obeng Presisi Elektrik Cordless Screwdriver Alat Perkakas Peralatan Elektronik Perlengkapan Bangunan;379900;379900;0;2;Kota Administrasi Jakarta Barat
AQUA Elektronik Google TV 50 Inch QLED UHD 4K HDR AQT50S80EUX;4999000;6057000;17;280;Kota Administrasi Jakarta Utara
AQUA Elektronik AQT43S80EUX Google TV 43 inch 4K HDR Bezel Less;4369000;4369000;0;2;Kota Administrasi Jakarta Utara
Tone control stereo 2.1 subwoofer ne5532 mitra sound modul elektronik original - IC Ne5532 Std;66000;76000;13;100;Jakarta Barat
AQUA AQT32K70M MIRACAST USB MOVIE 32 INCH DIGITAL TV HD READY I AQUA ELEKTRONIK AQT32K70M DIGITAL TV - KIRIM INSTAN;1625000;1625000;0;1;Kota Surabaya
SHARP R 21 DO /MICROWAVE/ELEKTRONIK DAPUR/ R21D0;1070000;1070000;0;1;Kota Surabaya
sikat pembersih PCB elektronik Cleaning;6900;6900;0;731;Kota Bogor
SP208ECA SSOP24 - Komponen Elektronik;22500;22500;0;70;Kota Tangerang Selatan
Lap Pembersih Kacamata Elektronik Sungglasess 1Box Halus dan Berkualitas - Aksesoris, Glasses - -, -;55000;55000;0;4;Kota Administrasi Jakarta Pusat
kabel power laptop adaptor colokan 3 Elektronik Computer - HITAM;10500;10500;0;52;Kota Administrasi Jakarta Barat
Elektronik Kenmaster Kabel Roll 6 Meter - Rol 4 Lubang 6M Stop Kontak;79000;79000;0;997;Kota Administrasi Jakarta Barat
MEGACOOLS CONTACT CLEANER PEMBERSIH KOMPONEN ELEKTRONIK 500ML;34990;34990;0;42;Kota Bekasi
Kris Kipas Angin Berdiri 45 Watt Standing Fan Penyejuk Ruangan Kipas Lantai Elektronik;839000;839000;0;714;Jakarta Selatan
TIMER MICROWAVE OVEN ELEKTRONIK 2 PIN 60 MENIT (WTA-3001);71000;71000;0;126;Kab. Tangerang
Elektronik indoor Modul pcb AC LG Inverter EBR81899802;485000;485000;0;11;Kota Denpasar
Tone control stereo plus meddle transistor mitra sound modul elektronik original;47500;57500;17;100;Jakarta Barat
Rice Cooker 1.6 Liter Magic Com Mini Portable Elektronik Rumah Tanga;489000;489000;0;4335;Jakarta Selatan
CR5249 CR5249T CR 5249T IC PWM Power Pengganti TNY398PN CR5229 Dip-8 Komponen Elektronik;15000;15000;0;193;Kota Depok
Misteri Box Ramadhan - Elektronik komputer mystery box indonesia - XS;100000;100000;0;5;Kota Palembang
Viser S5 100pcs Fisher Komponen Elektronik;7000;7000;0;8;Kota Bekasi
Jam Tangan Anak Elektronik Led Motif Kartun  Bahan Silikon Untuk Anak / Jam Tangan Karakter J - 009 RRNS Fashion - PEACH MICKEY;5749;20000;71;66;Kota Administrasi Jakarta Barat
AZKO Krisbow 4 inci Exhaust Fan Dengan Humidity Sensor Kipas Hexos Ventilasi Fan Ventilation Peralatan Elektronik Air Ventilator;499900;499900;0;4;Kota Administrasi Jakarta Pusat
Screwdriver Obeng Peralatan Elektronik 5 mm - 6 INCH PLUS;9000;9000;0;99;Kota Administrasi Jakarta Barat
AZKO Klaz Hair Dryer Speed 1350-1600 watt - Hitam Alat Pengering Rambut Hair Styler Elektronik Kecantikan;899900;899900;0;2;Kota Administrasi Jakarta Pusat
Kabel Jumper Elektronik 30AWG ( Kabel Tunggal ) Per 1 meter;1000;1000;0;136;Jakarta Timur
Mainan Anak Gantungan Kunci Pop It Jennie BlackPink Elektronik Kucing Paws Pop it Lucu Unik Viral - Merah Muda;15900;43998;64;9;Kab. Bandung
Obeng Set 115 In 1 Perkakas Service Handphone Alat Elektronik;80500;184126;56;912;Kota Administrasi Jakarta Utara
Addo Pitter Patter Pets Dance With Me Dinosaur & Daschund - Boneka Hewan Elektronik Anak - Dachshund;399000;699000;43;305;Kab. Bogor
YuGiOh - Uang Elektronik Kartu Flazz BCA Gen 2/ Emoney Mandiri - Flazz 1 Sisi;128000;138000;7;181;Jakarta Barat
Meteran Laser 100m Multifungsi Alat Ukur Jarak Penggaris Distance Meter LCD CP-100 Elektronik;294900;899900;67;76;Kota Tangerang
Adaptor 9V 2A / 9V 1A AC DC Power Supply 5.5mm - Kepala Charger Listrik Serbaguna Elektronik & Arduino Uno;29800;29800;0;20;Kota Bandung
AZKO Berwyn Smart Boxing Target Electronic Punching Target Perlengkapan Bela Diri Peralatan Boxing Dan Muaythai Alat Tinju Elektronik;1169100;1299000;10;5;Kota Administrasi Jakarta Barat
Informa Kels 300 ml Heyli Rice Cooker Mini - Abu-Abu Magic Jar Magic Com Penanak Nasi Alat Masak Beras Elektronik Dapur;279000;369000;24;6;Kota Administrasi Jakarta Barat
BIOTA Smart Plug - Colokan Portabel Otomatis Untuk Semua Elektronik Watt Meter Wifi Wireless persegi panjang stop kontak meja - Round;114480;216000;47;2;Kota Administrasi Jakarta Barat
Notaris dan Transaksi Elektronik Edmon Makarim Rajagrafindo;165000;165000;0;1;Jakarta Timur
Ataru True Wireless Bluetooth Earphone S30 Pro - Putih alat pendengar bluetooth perangkat elektronik earbuds;229900;399900;43;11;Kota Administrasi Jakarta Barat
Kompor tanam gas 2 tungku infrared rb elektronik;1900000;1900000;0;5;Jakarta Timur
Boks Enclosure Plastik untuk project / modul elektronik model G;20000;20000;0;14;Jakarta Timur
box plastik ABS DIY box kotak plastik project elektronik kecil - B.58x35x15mm;4000;4000;0;966;Kab. Sleman
Kabel Jumper jalur komponen elektronik kawat wire wrapping - Hitam;1200;1200;0;399;Kota Surabaya
Mainan pancing ikan elektronik / Fishing game magnetic 4 lubang ( SKW.685-10 );40000;40000;0;254;Kota Surabaya
rexco 18 contact cleaner 500 ml elektronik;46500;46500;0;756;Jakarta Pusat
Obeng Set Multi 31 / 32 in 1 Serbaguna Handphone Elektronik Laptop - 31 in 1;14900;14900;0;1;Kab. Tangerang
Tool Kit Elektronik Listrik Sellery 23pcs / Toolkit Sellery Listrik;485000;485000;0;2;Jakarta Pusat
YUEFEIBAO Feibao Toolset Elektronik 45 PCS / Electrician Toolbox 45Pcs / Toolset Perbaikan Gadget Elektronik / F28-1205;303202;705120;57;99;Kota Administrasi Jakarta Utara
AQUA Elektronik Mesin Cuci Top Loading AQW-77D-H (1 Tabung / 7KG) - J;2199000;2499000;12;108;Kota Administrasi Jakarta Utara
Lilin Led Candles Lilin Mini Elektrik 3PCS Lampu Lilin Ayunan Elektronik LED imulasi Lilin Lampu - S (5.5*10cm), 3PCS;74239;206219;64;91;Kab. Tangerang
Kipas las/elektronik Axial Fan 6 Inch 150FZY4-D;300000;300000;0;11;Kota Tangerang
Karet Kaki Box Elektronik Ampli Transparant + Skrup - MERAH;2800;2800;0;49;Kab. Bekasi
AQUA Elektronik Smart Android TV AQT43K701AF 43 Inch - Android 11;4999000;4999000;0;2;Kota Administrasi Jakarta Utara
Modul/pcb/elektronik indoor AC LG Plasma;175000;175000;0;45;Kota Denpasar
AQUA Elektronik Smart Android TV AQT43K701AF 43 Inch Android 11 - J;4999000;4999000;0;2;Kota Administrasi Jakarta Utara
IMPORT Joyoung L3-C61 Blender Korea Modern Alat Elektronik Mixer Chopper - L3-C61;475300;490000;3;12;Jakarta Barat
"LED Android Digital Google TV Polytron 32"" PLD-32RG9059";2299000;2299000;0;5;Kab. Tangerang
POLYTRON SMART TV PLD32CV1869 32 INCH DIGITAL TV I SMART TV POLYTRON - KIRIM INSTAN;1995000;1995000;0;10;Kota Surabaya
Miyako Kipas Angin(Stand Fan) KAS-1618 B - Rangka Plastik;267000;267000;0;5;Kota Bekasi
STAND FAN / KIPAS ANGIN BERDIRI MIYAKO 16 INCH 50 WATT KAS - 1607 PL;252450;255000;1;5;Kota Surabaya
Miyako KAS-1606X Kipas Angin - Plastik;247600;247600;0;4;Kota Bekasi
Software / Aplikasi Kwitansi elektronik;100000;100000;0;99996;Kota Semarang
Sekrup elektronik,komputer,Topi SUPER Mini 2,6x6 warna hitam,;220;220;0;360;Jakarta Timur
Cairan Pembersih Peralatan Elektronik - Megacools Contact Cleane 500ml;33200;33200;0;155;Kab. Sidoarjo
Gas Sepeda Listrik 3 Speed Universal / Handle Grip Gas Sepeda Listrik Konversi Sepeda Elektronik - Mobil listrik 123 rpm;27500;55000;50;483;Kota Administrasi Jakarta Barat
ID-COOLING TF-12025 PRO BLACK 120mm PWM Fan Elektronik - Warna;92900;92900;0;23;Kota Surabaya
MIYAKO Kipas Angin Berdiri 16 inch 1606XPL Standing Fan MIYAKO 16inch;262000;262000;0;10;Jakarta Barat
POLYTRON SMART TV DIGITAL 32 INCH PLD 32CV1869 / 32CV1869;1849000;1849000;0;68;Kota Tangerang Selatan
Kipas Angin Stand Fan KAS- 1627 KB- Miyako;328100;328100;0;1;Kab. Sleman
KIPAS ANGIN BERDIRI /STAND FAN MIYAKO 2IN 1- KAS 1627KB;321750;325000;1;5;Kota Surabaya
KIPAS ANGIN BERDIRI KAS 1618KB- MIYAKO;313500;313500;0;2;Kab. Sleman
CONTACT CLEANER/PEMBERSIH KOMPONEN ELEKTRONIK REXCO 18 500ml - 220ml;29000;29000;0;11;Kota Semarang
AQUA Elektronik Mesin Cuci Front Load 10.5Kg FQW-1050BF - FQW-1050BF;7499000;8899000;16;3;Kota Administrasi Jakarta Utara
Baby Simulated Drive - Mainan Setir Mobil Anak Elektronik Driving Toy - Driving Car;125000;125000;0;72;Kota Administrasi Jakarta Utara
Obeng Set 31 In 1 / Obeng set 31in1 Alat Service Listrik Elektronik;14500;14500;0;104;Kab. Bandung
Jam Tangan Digital Elektronik Tahan Air Led - BEIGE BUDDINGPOP;5299;5299;0;668;Kab. Tangerang
Box Kotak Plastik Power Supply Elektronik Electronic Plastic Shell 80x38x22 ABS 2 Outlet;7380;9000;18;24;Kab. Sleman
Kapasitor capacitor elektronik 100uf 800V DC utk mesin las 380V;380000;380000;0;22;Jakarta Barat
(500pcs) 3x5 Sekrup ppwm/ ts sekrup elektronik;35000;35000;0;86;Kab. Tangerang
Baut JP mini M 3x4mm komputer,elektronik,tolls, mainan (warna kuning);160;160;0;917;Jakarta Timur
KIPAS ANGIN BERDIRI / STAND FAN MIYAKO - KAS 1618 B;242550;245000;1;2;Kota Surabaya
"MIYAKO Kipas Angin Berdiri 16inch 1606XPL/Stand Fan MIYAKO 1606XPL 16""";265000;265000;0;9;Jakarta Barat
KIPAS ANGIN BERDIRI / STAND FAN MIYAKO 16 INCH 50 WATT KAS - 1606 X;227700;230000;1;14;Kota Surabaya
KIPAS ANGIN BERDIRI / STAND FAN MIYAKO - TJR 101;381150;385000;1;5;Kota Surabaya
Mesin Laser UV / UV Laser Marking Machine 5 Watt Portable Include Computer;84000000;84000000;0;1;Kab. Bogor
AZKO Ariete Setrika Uap 1000W Steamer Steam Iron Elektronik Rumah Tangga Setrikaan Pakaian Uap Panas;899900;899900;0;1;Kota Administrasi Jakarta Barat
Ultrasonic Cleaner Mesin Pembersih Perhiasan Kacamata Elektronik Medis;420900;420900;0;100;Jakarta Barat
Tekiro Electronic Flat Nose Pliers / Tang Elektronik 5 Inch Plat - Green;47900;69000;31;9;Kota Administrasi Jakarta Utara
New Pop it Elektronik Quick Push Buble Game Challenge/Fidget Toys - Mini Elektrik;13450;13450;0;111;Kota Bekasi
Smart digital lock Dekkson ELP 9419 MF FIN PASS DV / Kunci Elektronik;4875000;4875000;0;5;Kota Surabaya
Box plastik hitam Rem 1, Box Elektronik Mini 1 kuping 3,4 X 2 X 3,5 CM;1750;1750;0;985;Jakarta Barat
Mesin Laser UV / UV Laser Marking Machine 3 Watt Portable Include Computer;78000000;78000000;0;1;Kab. Bogor
obeng panjang (+) crv 4 mm obeng elektronik obeng plus phillips magnet - 4 inch;21835;21835;0;1;Kota Surabaya
AQUA Elektronik FQW-850900QD Mesin Cuci Front Loading 8.5 Kg - Smart Dual Spray - Steam - ABT Treatment - Pillow Drum - Baby Care;5372000;5372000;0;10;Kota Administrasi Jakarta Utara
Promo T5,6,7,8,9,10 obeng service hp dan elektronik BUKAN OBENG PLUS;5000;5000;0;25;Kota Administrasi Jakarta Selatan
PHILIPS EB-C 228 TL5 220-240V 50/60Hz -BALLAST ELEKTRONIK - OSRAM;128500;128500;0;997;Jakarta Barat
Obeng Set 12 in 1 Bolak Balik 12 mata Screwdriber Reparasi Elektronik - Obeng 6 in 1;11700;11700;0;2;Jakarta Barat
Toumapet Tamagotchi Virtual Pet Elektronik Berwarna ada Fitur Camera Mainan Hewan Peliharaan - Pink;395000;500000;21;6;Kota Administrasi Jakarta Barat
Box Komponen - Box Rakit Elektronik - Box X2 New GB + Klip - Box + Sekrup;6500;6500;0;99;Jakarta Barat
AZKO Krisbow Stop Kontak 4 Soket Usb A & Type C Electric Socket Terminal Colokan Listrik Kotak Kontak Peralatan Elektronik;269900;269900;0;10;Kota Administrasi Jakarta Pusat
Reaady Casing Enclosure Bahan Aluminium untuk Proyek Elektronik DIY;55693;55693;0;759;Jakarta Utara
Jam Tangan LD8 Kartun Jam Tangan Anak Elektronik Led Motif Kartun Lucu - Beige Pinky;10999;10999;0;94;Kota Medan
AZKO Krisbow 6 inci Blower Inline Duct Fan Kipas Hexos Ventilasi Fan Ventilation Peralatan Elektronik Air Ventilator;599900;599900;0;2;Kota Administrasi Jakarta Barat
Ecu elektronik control unit chevrolet captiva diesel facelift FL C140;4500000;4500000;0;2;Jakarta Barat
Pinset Tweezer Bengkok Jepit Elektronik ESD-15 Hitam Panjang 122 mm - Runcing ESD 12;7500;20000;63;43;Kab. Sleman
Breville Multi-Purpose Microfiber - Kain Serbaguna Peralatan Rumah Elektronik Dapur - Grey;99000;99000;0;10;Kota Administrasi Jakarta Utara
BTS x LV - Uang Elektronik Kartu Flazz BCA Gen 2/ Emoney Mandiri - Flazz 1 Sisi;138000;138000;0;79;Jakarta Barat
Meteran Laser 100m Alat Ukur Jarak Multifungsi Penggaris Elektronik Distance Meter LCD CP-100;294900;899900;67;76;Kota Tangerang
Megacools Contact Cleaner Megacool Pembersih Elektrik Elektronik 500mL;37000;37000;0;5;Kota Surabaya
AQUA Elektronik TV AQT75S800UX - 4K HDR - Google TV - Bezel Less - RAM 2GB ROM 32GB - Digital TV;11199000;18500000;39;7;Kota Administrasi Jakarta Utara
Pembersih Elektronik Cleaning Cleaner Kit Electronic HP Headset Airpod - Cleaner Kit;37500;59000;36;1;Kota Tangerang
Baterai Mainan RC, Elektronik 3X 18650 3S 12V 20A 4500mAh PUTIH PH 3 p;78650;78650;0;497;Jakarta Pusat
NYK Kabel Power Universal 3 Lubang for PC, Monitor, dan Alat Elektronik - 1.5M;16500;16500;0;0;Kota Bandung
Ultrasonic Cleaner 800ML Pembersih Perhiasan Kacamata Elektronik Multifungsi 35 Watt;489000;522600;6;489;Kota Administrasi Jakarta Barat
Trafo Ballast Elektronik TL / Neon 10W 20W 40W;17500;17500;0;1369;Kota Bandung
2TB 1TB Flash Drive 3in1 OTG Type C USB Mini Flash Drive High Speed ​​Pen Drive for Phone/Tablet/PC Alat Alat Penyimpanan Elektronik - Green , 2TB;119599;269999;56;829;Kota Tangerang
LIMITED! Al Qur'an Elektronik Al Fatih, AlQur'an Pena Digital + IQRO;786000;786000;0;679;Jakarta Pusat
DELI Kalkulator Elektronik - 837ES;33000;33000;0;3;Jakarta Barat
Menerima Scrap atau Limbah Elektronik Komputer Dgn Hrg Tinggi;1000000;1000000;0;100;Jakarta Timur
Toolkit Electrical 14pcs SANDS Tool Kit Elektronik Set Lengkap 14 pcs;195000;195000;0;174;Jakarta Timur
Baterai Speaker / Baterai CCTV PANEL SURYA Dan Alat Elektronik Lainnya;118250;135000;12;1997;Jakarta Pusat
YASNA WIJAYA PLASTIK SAMPUL MAP F4 SAMPUL SERTIPIKAT ELEKTRONIK BPN map sertifikat tanah hard cover - Hitam;13500;13500;0;997;Kota Bandung
AQUA Elektronik AQA-KCR9VRAL AC 1 PK Inverter UV Cool Wifi Control | With UVC Sterillization;4515000;4515000;0;99;Kota Administrasi Jakarta Utara
AQUA Elektronik Smart Android TV LE43AQT6700FG 43 Inch - Android 11 - LE43AQT6700FG;2949000;3737000;21;343;Kota Administrasi Jakarta Utara
AQUA Elektronik 4K HDR Google TV 50 Inch AQT50K800UX;4699000;5670000;17;5;Kota Administrasi Jakarta Utara
AQUA Elektronik AQR-DTM285RAP(FB) Kulkas 2 Door 225L - Inverter -Turbo cooling - Black shine;3198900;4299000;26;49;Kota Administrasi Jakarta Utara
Packing Kayu Produk Elektronik TV AIOPC Monitor;200000;200000;0;69;Kota Administrasi Jakarta Utara
Tas Travel Tempat Perlengkapan Elektronik Organizer Gadget Storage Bag Waterproof - RH2418 - Hitam Anti air;125000;250000;50;18;Kota Administrasi Jakarta Barat
MIIGO Piano Elektronik Multifungsi 88-Key, Elektronik Profesional Rum - paket 1;1389000;1389000;0;0;Kab. Tangerang
Custom Uang Elektronik untuk digunakan naik transportasi umum dan pembayaran nontunai - FLAZZ, 1 SISI;75000;115000;35;490;Kota Administrasi Jakarta Selatan
TANG POTONG ELEKTRONIK ELECTRONIC CUTTING PLIER 5IN KRISBOW KW010136;212430;212430;0;98;Jakarta Utara
Air Purifier with UV Light Hepa Filter Touch Screen Air Quality Light - Air Purifier718;2600000;2600000;0;39;Jakarta Barat
HEPA Filter H13 12”12”6” DEKATECH 305 x 305 x 150 mm AHU HVAC;1350000;1350000;0;16;Kab. Sidoarjo
"Bracket TV Standing NORTH BAYOU NB AVA1800 AVA 1800 70 1P 55"" - 90"" INCH";1849000;1849000;0;200;Kota Administrasi Jakarta Barat
"Primary / Pre-Filter Aluminium+MESH 24""24""2"" 595 x 595 x 46mm AHU HVAC";399000;399000;0;99;Kab. Sidoarjo
GREE Air Curtain FM-1.25-9-K 110Watt FM1.25-9K;2989000;2989000;0;10;Kota Administrasi Jakarta Barat
PANGKAT PDH LETDA LEK elektronik AU;75000;75000;0;8;Jakarta Pusat
Kartu E-money Uang Elektronik BRI BRIZZI - Flazz Arsenal;65000;65000;0;1;Jakarta Pusat
Kels 1.2 ltr Weldon Rice Cooker Multifungsi - Putih Magic Jar Magic Com Penanak Nasi Alat Masak Beras Elektronik Dapur;719100;799000;10;11;Kota Tangerang Selatan
bearing bering laher donat besi plastik metal ball roller 6201 zz rs polos roda pagar pompa air alat mesin bor gurinda sepeda elektronik - PLS 6201 zz;4299;4299;0;3;Kota Bekasi
BATERAI ELEKTRONIK 401520 UKURAN 15mm x 20mm KABEL 2 BATTERY UNIVERSAL;25000;25000;0;99986;Jakarta Barat
Kris 2 ltr Humidifier - Putih Alat Pengatur Kelembapan Udara Mesin Peningkat Kelembaban Elektronik Rumah Tangga;374000;399000;6;97;Kota Bekasi
Ballast Elektronik 10w;15000;15000;0;91;Kota Surabaya
"TJAP MATA / CAP MATA Tang Elektronik Knip / Potong / Cutting Plier 5 """;40000;40000;0;44;Kota Administrasi Jakarta Pusat
New Box X9 Serba Guna untuk Custom Elektro/Elektronik 24 x 14 x9,5cm;33000;33000;0;98835;Kab. Sidoarjo
kulkas vaksin crismed kulkas;30000000;30000000;0;10;Kab. Bekasi
MANIFOLD VALUE R22,R407,R404 R134;580000;580000;0;493;Jakarta Barat
jar 600 ML super tebal!!SEMUA JASA KIRIM;2450;2450;0;4990;Kab. Tangerang
Compressor Danfoss SZ110 / SZ110S4VC 9PK R22 380V;7100000;7100000;0;3;Kota Administrasi Jakarta Barat
antena tv digital + kabel 13 meter dijamin BENING;100000;100000;0;657;Jakarta Timur
OA546 Better Kotak Pensil Elektronik Dengan Password;241000;241000;0;4998;Jakarta Timur
BUKU PAHLAWAN SAMPAH ELEKTRONIK - SERI BECOMING A CHANGEMAKER;58650;69000;15;85;Kota Depok
AQUA Elektronik TV Digital AQT32K70M 32 Inch HD;1479000;2799000;47;110;Kota Administrasi Jakarta Utara
Mini Ultrasonic Cleaner DADI DA-968 + Timer Murah Pembersih Elektronik - Analog;290000;290000;0;886;Jakarta Pusat
Adaptor 12V 2A untuk CCTV, LED, Kipas, Modem Router, dan Peralatan Elektronik;17200;17200;0;510;Kota Administrasi Jakarta Utara
Kit PCB flip flop bunyi sirine u belajar merakit elektronik DIY - Belum disolder;25000;25000;0;19;Kota Bandung
silicone grease greese lubricant elektronik 50gr, silikon grease 50gr;9000;9000;0;30;Kota Administrasi Jakarta Utara
AZKO Krisbow Desktop Charger Gan 75 Watt Dengan Soket & Kabel Electric Socket Terminal Colokan Listrik Kotak Kontak Peralatan Elektronik;649900;649900;0;5;Kota Administrasi Jakarta Pusat
Baterai Speaker / Vacum Dan Alat Elektronik Lainnya 2X 18650 6800mAh 14,8V BMS 4S 10A SOKET XH 2 PIN;118750;125000;5;990;Jakarta Pusat
Compressor Danfoss Piston MTZ22 / MTZ22JC4AVE 2PK R404 380V;5250000;5250000;0;5;Kota Administrasi Jakarta Barat
Replacement untuk Filter Blueair Sense+ / Sense HEPA+CARBON FILTER;569000;1249000;54;60;Jakarta Barat
Bracket Breket Braket Standing Tv LED/LCD 24 32 43 50 55 60 65 Inch - 24-43 INCH;399000;399000;0;5;Kota Administrasi Jakarta Barat
Compressor DANFOSS MT28J4AVE R22;4750000;4750000;0;3;Kota Administrasi Jakarta Barat
Sarung Jari Tangan Karet Latex Fingers Glove facial repair elektronik;200;200;0;58696;Kota Bogor
Alat Hitung Cepat 4 Digit / Hand Tally Counter / Alat Hitung Elektronik / Alat Hitung Digital / Hand Counter / Alat Dzikir / Tasbih;16900;26000;35;14915;Kota Administrasi Jakarta Utara
Rexco 18 Contact Cleaner / Pembersih Komponen Elektronik 220ml;31999;31999;0;49;Kota Bandung
Baterai Alkaline AAAA / A4 / E96 - Batre Stylus Elektronik dan Medis;15000;15000;0;4180;Jakarta Barat
Kels 1.2 ltr Warren Rice Cooker Multifungsi - Copper Magic Jar Magic Com Penanak Nasi Alat Masak Beras Elektronik Dapur;499000;749000;33;1;Kota Tangerang Selatan
Baut payung casing,modul elektronik M2,6x7mm putih drat halus;260;260;0;40;Jakarta Timur
