title;price;original price;discount;stock;delivery
Karpet Elektronik (Piu Dance Pad / Pump It Up) Single Termurah;1073000;1073000;0;2;Kota Bekasi
FOX40 Peluit Elektronik Original;160000;160000;0;100;Kota Administrasi Jakarta Barat
Squid Game Card- Uang Elektronik Kartu Flazz BCA Gen 2/ Emoney Mandiri - Flazz 1 Sisi;138000;138000;0;186;Jakarta Barat
LOZ Micro Block ( CUTE APPLIANCE / ELEKTRONIK CHIBI ) Puzzle Kado Lucu - (MESIN CUCI) 26;49900;49900;0;8;Jakarta Barat
Electrolux Kulkas Side by Side 656L ESE6645A-BID;13472000;16003000;16;15;Kota Administrasi Jakarta Utara
KOMPRESOR BITZER 4HE-18Y;67500000;67500000;0;6;Jakarta Barat
pully carbonate kaca;1800000;1800000;0;1000;Kota Tangerang Selatan
AC 1 PK STANDAR UNIT ONLY MITSUBISHI HEAVY INDUSTRIES SRK09CTR-S3;5119000;5119000;0;30;Kota Administrasi Jakarta Pusat
Contact Cleaner Pembersih Electrik & Elektronik Gst52 Cairan - 500ml;30000;32000;6;833;Kab. Bogor
obeng panjang (+) crv 3 mm obeng elektronik obeng plus phillips magnet - 3 inch;16225;16225;0;1;Kota Surabaya
Charger Mobil Ganda USB Cepat Aman Car Dual Port Fast Charging QC 3.0 2.4A Hp Smartphone Elektronik - Hitam;28300;28300;0;209;Kota Surabaya
Megacools contact cleaner / Pembersih komponen elektronic elektronik;36500;36500;0;5;Kota Bandung
LIGE sub-merek FOXBOX Jam Tangan Elektronik Pria Jam Tangan Olahraga Tahan Air Digital Chrono Multifungsi Hadiah Watches - emas;159000;499000;68;79;Kota Administrasi Jakarta Barat
DELAY TIMER MICROWAVE OVEN ELEKTRONIK 2 PIN 60 MENIT TYPE DKJ-60 AC-15;60000;60000;0;940;Jakarta Barat
Cairan Pembersih untuk Peralatan Elektronik dan Listrik Dust Cleaner - 20 liter;22400000;22400000;0;144;Kota Administrasi Jakarta Pusat
JAM TANGAN WANITA VERSI KOREA JAM TANGAN ELEKTRONIK FASHION PREMIUM - Putih;18500;88000;79;38;Kota Administrasi Jakarta Utara
Kompas Pivoting Elektronik Dengan Lampu Led Presisi Tinggi Untuk Navigasi Mobil/Kapal Laut - Black;129000;129000;0;112;Kota Cimahi
Tool Kit Set S20 S-20 Murah Lengkap CADIK Pertukangan Elektronik;950000;950000;0;5;Kota Surabaya
Batere Bateray Kotak 9V Doublepow Battery untuk Mainan Elektronik;13999;19999;30;15;Kota Tangerang Selatan
Travo ballast Elektronik Elektrik TL 10w 15w 20w 40w 220V;16000;16000;0;122;Kota Surabaya
HOTSALE Jam Tangan LED Pokemon Animasi Pickohu Jam Tangan Elektronik J;475300;475300;0;99;Jakarta Selatan
Klakson basuri telolet elektronik 24 v;475000;475000;0;96;Kab. Bekasi
Timbangan digital 3kg akurasi 0.1 gram timbangan elektronik;59900;59900;0;10;Kota Bandung
100 pcs baut M3x6 JP kepala bulat PH baut elektronik - Kepala rata/JF;4700;4700;0;9;Kota Surabaya
Papan Elektronik Komputer Catur Pemula dengan Berbicara Modern;1858800;1858800;0;19;Jakarta Barat
BATERAI ELEKTRONIK 805080 UKURAN 50mm x 80mm BATTERY UNIVERSAL MANTUL - KABEL 2;85000;85000;0;9;Jakarta Barat
KAMUS ELEKTRONIK INGGRIS-INDONESIA-CHINA ALFALINK E1C-1430TT 04M4YZ4 p;498000;498000;0;1;Kab. Bekasi
Bell Sepeda Elektronik Rechargeable model Sentuh Sirene Bike horn - Hitam;166000;166000;0;1;Kab. Tegal
PELUMAS/PEMBERSIH ELEKTRONIK- REXCO18 CONTACT CLEANER 500 ML;43025;43025;0;14;Jakarta Utara
Lem LCD HP Perekat Peralatan Elektronik Serbaguna / Power Glue Strong Adhesive 15ML - Transparan;5800;5800;0;244;Kota Depok
Sistem Rekam Medis Elektronik Healmity Paket 12 Bulan (Bonus Gratis 3 Bulan);4788000;4788000;0;820;Kota Bandung
Tinol Tenol Kawat Timah Solder Penyambung Komponen Elektronik PCB 4.0 MM - 0.4mm;20191;20350;1;81;Kota Administrasi Jakarta Pusat
Trafo 146x57x35mm 220V-240V 7500V 30mA Elektronik Neon Sign Supply;670900;670900;0;880;Kota Bekasi
TEKIRO Kunci L Hex Key Elektronik Mini 7 Pcs TEKIRO - mm;25900;25900;0;7;Kota Semarang
Bigfun Portable 37-Key Key Elektronik Piano Mini Electronic Organ;588942;588942;0;1;Jakarta Timur
Tas Pocket Serbaguna - Tas Organizer Elektronik Penyimpanan Gadget - ShaFOX HP29;23900;23900;0;198;Kota Tangerang
Melodi Elektronik Store - Kabel Single Pure Sterling Silver 99.998% Solid Core Teflon - 24awg;198000;198000;0;12;Kota Tangerang Selatan
Thermal Pasta / Thermal Grease Elektronik,HY-510 Merk Halnziye;2600;2600;0;4;Jakarta Timur
Trafo elektrik Ballast elektronik TL neon 20W 40W;18000;18000;0;298;Kota Tangerang
UGREEN Wireless HDMI Video Transmitter Receiver Extender Display Tv 5M - 50633A;1350000;1800000;25;31;Kota Administrasi Jakarta Pusat
Basic (Family Set) - Soda maker by Sodafresh | DrinkMate style;1939000;1939000;0;39;Kota Administrasi Jakarta Pusat
Compressor JT125G / JT125G-P4Y1 4PK R410A 380V;4200000;4200000;0;3;Kota Administrasi Jakarta Barat
Electrolux Air Fryer E5AF1-600P / E5AF1 600P;1310000;1580000;17;50;Jakarta Utara
Compressor Copeland ZR45KCE / ZR45KCE-TFD-522 3,5PK R407C 380V;3450000;3450000;0;5;Kota Administrasi Jakarta Barat
Compressor Danfoss Piston MTZ125 / MTZ125HU4VE 10PK R404 380V;10200000;10200000;0;3;Kota Administrasi Jakarta Barat
GREE AC Split Inverter R32 1.5 PK GWC-12F5-S Smart Clean GWC-12F5S - Tanpa Pasang, AC Saja;5999000;5999000;0;3;Jakarta Utara
Compressor Danfoss MTZ36 / MTZ36JG4BVE 3PK R404 380V;5500000;5500000;0;5;Kota Administrasi Jakarta Barat
KOMPRESSOR/COMPRESSOR DANFOSS MTZ18/MTZ18JA5AVE 1 1/2PK R404A 1PHASE;5200000;5200000;0;5;Jakarta Barat
COMPRESSOR DANFOSS MT22JC4AVE 3PHASE;5215000;5215000;0;3;Kota Administrasi Jakarta Barat
THERMALRIGHT TL-B14B EXTREM High Static Pressure 140mm PWM Fan Elektronik - Warna;396000;396000;0;17;Kota Surabaya
Jam Tangan Digital Pria Tahan Air LED Multifungsi Alarm Kronograf Silikon Jam Tangan Olahraga Elektronik Pria Hadiah Kaca Watches - Black;25600;82600;69;995;Kab. Tangerang
E-Money uang elektronik bca flazz mandiri;58000;58000;0;5;Jakarta Selatan
SW-200D Saklar Sudut Miring Tilt Elektronik Dengan Sensor Getaran;5000;5000;0;78;Kab. Cirebon
Humidifier Diffuser Aroma Terapi Ultrasonic Bluetooth Essential Oil - TanpaSpeaker;139000;175000;21;9;Jakarta Barat
KONEKTOR N MALE TERMINATOR 75 OHM;30000;30000;0;99;Jakarta Barat
LG 50UR7500 Smart TV LED 4K UHD AI ThinQ TV 50 Inch 50UR7500PSC - +KAYU WAJIB JNE;4875000;4875000;0;19;Jakarta Utara
KOMPRESOR/COMPRESSOR DANFOSS SM161/SM161T4VC 13PK R22 3PH;8850000;8850000;0;10;Jakarta Barat
Electrolux E2CM1-200W Coffee Maker;500000;500000;0;93;Jakarta Barat
HUKUM INFORMASI DAN TRANSAKSI ELEKTRONIK By Dr. Siswanto;45000;45000;0;8;Jakarta Pusat
Kabel Kawat Jumper Hp 0.010 MM Alat Service Elektronik;2000;2000;0;998;Jakarta Barat
BOX PVC RAKITAN X-6 SERBAGUNA PROJECT RANGKAIAN ELEKTRONIK TV BOK;10900;10900;0;179;Kota Bandung
PIANO TECHNO ORIGINAL KEYBOARD ELEKTRONIK 49-tuts MUSIK T5000 + MIC;412400;460000;10;28;Kota Surabaya
Sesuai untuk(iPhone 7)kasus telepon,Komponen elektronik,bahan kaca tempered, anti drop, anti slip, wear-resistant - 1, iPhone 7;59000;100000;41;9;Kab. Tangerang
Kabel Jumper jalur komponen elektronik kawat wire wrapping - Merah;1100;1100;0;740;Kota Surabaya
AQUA Elektronik 4K HDR Google TV 50 Inch AQT50K800UX;4479000;7999000;44;81;Kota Administrasi Jakarta Utara
Benston Music- Drum elektrik. Set drum elektronik, drum elektronik rumah untuk anak-anak dan pemula, drum elektronik profesional;2899000;3999000;28;2;Kab. Tangerang
TYN812 tyn812 SCR Thyristor TO-220 Komponen Elektronik;10000;10000;0;912;Kota Depok
Capasitor 32uf BAG Elektronik 10007851 MKP 32uf;50000;50000;0;94;Jakarta Barat
vent cap topi 4 inch;190000;190000;0;9717;Jakarta Utara
Paket Filter 2021 new product Pawalle power filter socket audio level - Tp60 bundling;725000;725000;0;30;Kota Depok
Jincool Sinochem - Freon AC R32 (Kaleng 650gram) Freon Jincool;181900;181900;0;51;Kota Administrasi Jakarta Barat
"Alumunium selang Exhaust 4"" Flexible duct hose ducting";27000;27000;0;99489;Jakarta Utara
Kabel Toslink Optical Digital SPDIF Audio Fiber Optic UGREEN 1M 2M 3M - TOSLINK PVC, 1 METER;45000;45000;0;36;Kota Administrasi Jakarta Pusat
PHILIPS ballast Balas Travo Elektrik Elektronik 36W 36 WATT EBC EP;58349;58349;0;356;Kota Tangerang
Mainan Pop It Elektronik Push Bubble Fidget Toys// POP IT GAME - Bebek;38000;38000;0;17;Kota Medan
PCB Assembly Solder Komponen Elektronik SMD DIP Single Double Layer;1044000;1044000;0;99999;Kota Tangerang
Electric Cleaning Brush Airsee Waterproof Sikat Pembersih elektronik;250000;250000;0;17;Kab. Tangerang
Kunci Kontak Elektronik ke Kunci Bulat Harley FL MCS USA Import;1378000;1378000;0;99;Jakarta Selatan
BATERAI ELEKTRONIK 703040 UKURAN 30mm x 40mm MODEL KABEL 2 BATTERY UNIVERSAL;34900;34900;0;99995;Jakarta Barat
YCS Y101 2D Screwdriver Set - Obeng Set 5in1 Repair Elektronik Handphone - Strong Magnetic;220000;220000;0;3;Jakarta Barat
Sikat kamar mandi wc toilet elektrik elektronik Hurricane Spin Scrubbe;195000;195000;0;500;Jakarta Barat
Box Plastik Hitam Kecil 1 Kuping / Box Elektronik;5000;5000;0;1852;Jakarta Barat
remot stb remote stb UNIVERSAL bisa semua merk stb;15000;15000;0;963;Jakarta Timur
Paket Protective Pipe / Cover Pipa AC Rifeng Uk. 1 Meter;173000;173000;0;81;Kota Tangerang
LG 32LQ570 Smart TV LED 32 Inch HD HDR 10 Digital WiFi 32LQ570BPSA - Dilayani Seller;2269000;2269000;0;0;Jakarta Utara
CEILING FAN MT EDMA STUDIO 56 inch - Putih;3040000;3040000;0;44;Jakarta Pusat
Sesuai untuk(iPhone 14)kasus telepon,Komponen elektronik,bahan kaca tempered, anti drop, anti slip, wear-resistant - 1, iPhone 14;59000;100000;41;9;Kab. Tangerang
AQUA Elektronik Mesin Cuci 1 Tabung 8 Kg Top Loading AQW-88DD;2199000;2799000;21;55;Kota Administrasi Jakarta Utara
Box plastik hitam Rem 3, Box Elektronik Mini 1 kuping 6 X 2,5 X4 CM;2850;2850;0;1144;Jakarta Barat
sampul sertipikat elektronik custom;13500;13500;0;10000;Kota Bandung
LBT TASBIH DIGITAL MINI Alat Hitung Elektronik Penghitung Jari Mini - HITAM;3045;3045;0;33;Kab. Tangerang
Contact Cleaner / Pembersih Komponen Elektrik / Elektronik - Contact Cleaner;23888;23888;0;19;Kota Surabaya
ASANO Pembersih Elektronik 500 ml Super Strong Formula Contact Cleaner 350 gr;28500;28500;0;12;Kota Semarang
Rexco 18 Contact Cleaner Pembersih Elektrik & Elektronik 220 mL;31000;31000;0;553;Jakarta Barat
Taffware Digipounds Gason Timbangan Badan Elektronik 180kg - SC-01 - Pink;59600;59600;0;70;Kab. Bogor
Mesin Cuci 1 Tabung Elektronik Rumah Tangga Denpoo DWF-073HT;1889726;1889726;0;3;Kota Depok
AZKO Krisbow Sync Smart Sensor Jendela Atau Pintu Wifi - Putih Alat Detektor Nirkabel Smart Sensor Window Door Elektronik Rumah Tangga;118900;169900;30;1;Kota Administrasi Jakarta Barat
module electronic elektronik mitsubishi outlander sport 2.0 cc 4B11 original 8634A058;1750000;1750000;0;10;Kota Depok
( 1 pcs ) TEKNOX Baterai Alkaline AAAA / A4 / E96 / LR61 - Batre Stylus Elektronik dan Medis;14500;20000;28;532;Jakarta Barat
EKSTRA BUBBLE WRAP (DEMI KEAMANAN) - ELEKTRONIK PS4 / PLAYSTATION 4;20000;20000;0;99999;Jakarta Barat
KUNCI L SET ELEKTRONIK PENDEK KECIL TEKIRO HK-EL1198 ELECTRO HEX KEY;27000;27000;0;99937;Kota Administrasi Jakarta Barat
Storage Box 36Slot Tempat Penyimpanan Komponen Elektronik 275*175*43mm;33300;33300;0;194;Kota Bekasi
Pouch Tas Organizer Elektronik Kabel Charger Penyimpanan Gadget Bag - Abu-abu;47000;47000;0;48;Kota Administrasi Jakarta Barat
Artch - Archipay - E-Money Kartu Elektronik - Sans;193500;215000;10;4;Kota Bandung
TASBIH DIGITAL MINI Alat Hitung Elektronik Finger Tally Counter Mini Jari Penghitung;2860;2860;0;9607;Kota Administrasi Jakarta Barat
Naturehike Kompor Glamping Elektronik, Tungku Kaset Perlindungan Tekan;300000;300000;0;14;Jakarta Barat
Bonkyo V8s Soundcard Audio Usb External Mixer Bluetooth Mic For Phone Pc Sound Card Live Laptop Elektronik Komputer - V8S;109900;299900;63;5;Kota Administrasi Jakarta Barat
Trafo Halogen / Electronic Transformer trafo elektronik 50W;10000;10000;0;287;Jakarta Utara
Perapih Kabel Spiral Pengikat Rem Shifter Sepeda Komputer Elektronik;7000;7000;0;2990;Jakarta Barat
Keqing Edition - Uang Elektronik Kartu Genshin Emoney Etoll Mandiri - Emoney 1 Sisi;85000;85000;0;23;Jakarta Barat
Obeng Ketok Multi Fungsi min (-) Magnet Khusus Elektronik dan Otomotif 4 inch;8900;9999;11;2966;Kab. Bekasi
Ballast Elektrik / Trafo Elektronik Lampu TL Neon 20w / 40w;23500;23500;0;97989;Jakarta Barat
Solder Adjustable 60W Atur Suhu Temperature Laptop HP Elektronik - Set Kepala 3pcs;9500;9500;0;9;Kota Tangerang
Unibell Selotip Isolasi Kabel Listrik 16mm x 20m X 0.13mm Hitam Elektronik Electrical Tape - KECIL;3600;3600;0;20;Kota Bandung
"EXAUST DINDING SEKAI WEF 1290 UK 12""";313500;313500;0;8;Kab. Karawang
CEILING FAN MT EDMA BEST 3 54inch - Mocha;845250;862500;2;404;Jakarta Pusat
JISULIFE Hand Fan Pro1S FA53PRO 100S 5000 mAh - Cokelat;755000;1120000;33;9;Kota Administrasi Jakarta Timur
AQUA Elektronik 4K HDR Google TV 50 Inch AQT50K800UX;4699000;5670000;17;15;Kota Administrasi Jakarta Utara
AQUA Elektronik AQR-DTM285CBP(DS) Kulkas 2 Door 225L - Turbo cooling - Dark Silver;2995000;2995000;0;3;Kota Tangerang Selatan
AQUA Elektronik AQR-DTM285RAP(FB) Kulkas 2 Door 225L - Inverter -Turbo cooling - Black shine;3198900;4299000;26;49;Kota Administrasi Jakarta Utara
Packing Kayu Produk Elektronik TV AIOPC Monitor;200000;200000;0;69;Kota Administrasi Jakarta Utara
AQUA Elektronik LE58AQT6700UG Android TV Smart AI 58 Inch 4K;5349000;6830000;22;117;Kota Administrasi Jakarta Utara
Timer Microwave oven elektronik 2 pin 120 menit (WTA-3002B-120) - TIMER SAJA;71000;71000;0;169;Kab. Tangerang
AQUA ELEKTRONIK TV Android LE43AQT6700FG Smart TV 43 inch;3304000;3304000;0;2;Kota Administrasi Jakarta Utara
Ballast Elektrik / Trafo Elektronik Lampu TL Neon 20w / 40w;23500;23500;0;97989;Jakarta Barat
Solder Adjustable 60W Atur Suhu Temperature Laptop HP Elektronik - Set Kepala 3pcs;9500;9500;0;9;Kota Tangerang
Unibell Selotip Isolasi Kabel Listrik 16mm x 20m X 0.13mm Hitam Elektronik Electrical Tape - KECIL;3600;3600;0;20;Kota Bandung
AQUA Elektronik 4K HDR Google TV 55 Inch AQT55K800UX;5799000;10299000;44;4;Kota Administrasi Jakarta Utara
SMEG CJF01 Citrus Juicer - Pemeras Jeruk Elektronik - White;4150000;4150000;0;16;Jakarta Barat
AQUA Elektronik Google TV 65inch HQLED AQT65P750UX;10999000;10999000;0;5;Kota Administrasi Jakarta Utara
Tone control stereo plus meddle ne5532 mitra sound modul elektronik original - Ic Ne5532 Std;45500;55500;18;99;Jakarta Barat
AQUA Elektronik AQT43S80EUX Google TV 43 inch 4K HDR Bezel Less;4369000;4369000;0;2;Kota Administrasi Jakarta Utara
TC4427AEOA SOP8 - Komponen Elektronik;21000;21000;0;100000;Kota Tangerang Selatan
Lem Odol Elektronik Kabel Listrik High Temperature Electric Insulation - White Liquid;18500;18500;0;57;Jakarta Timur
𝐂𝟎- My.L Kantong Sertifikat Tanah Elektronik BPN Map Sertipikat Rumah F4 HardCover & Sofcover - Hitam, SoftCover;11000;11000;0;70;Kota Bandung
AQUA Elektronik Kulkas Side By Side AQR-695IM(GB) 630 Liter;14999000;14999000;0;10;Kab. Sidoarjo
Tang potong elektronik / Electronic Flat Nose Pliers LAKONI PRO 401552;28500;28500;0;14;Jakarta Utara
Wilenca Speaker Pengusir Tikus Ultrasonic /Rumah Elektronik Anti Nyamuk/ Kelelawar /Lalat Pest Repeller - Black;115000;115000;0;49;Kota Depok
kalkulator Elektronik Joyko CC-15A, 12 digits bisa Check&Correck(14x12;55000;55000;0;42;Kota Tangerang
ALFALINK KAMUS ELEKTRONIK;20000;20000;0;1;Kab. Bekasi
"Tora Electronic Scissor 7"" - TR AP7 Gunting Elektronik 7 Inch";32500;32500;0;996;Jakarta Barat
Tone control stereo 2.1 subwoofer ne5532 mitra sound modul elektronik original - IC Ne5532 Std;66000;76000;13;100;Jakarta Barat
AQUA Elektronik AQR-DTM285RAP(FB) Kulkas 2 Door 225L - Inverter -Turbo cooling - Black shine;3429000;3429000;0;3;Kota Tangerang Selatan
AQUA Elektronik 4K HDR Google TV 50 Inch AQT50K800UX;4699000;5670000;17;15;Kota Administrasi Jakarta Utara
AQUA AQT32K70M MIRACAST USB MOVIE 32 INCH DIGITAL TV HD READY I AQUA ELEKTRONIK AQT32K70M DIGITAL TV - KIRIM INSTAN;1625000;1625000;0;1;Kota Surabaya
BATERAI ELEKTRONIK UNIVERSAL 400830 8MM X 30MM 550MAH TEBAL 4MM MODEL SOKET MANTUL HARGA PABRIK;20000;20000;0;99691;Jakarta Barat
Kamus Elektronik Alfalink 24 Bahasa;100000;100000;0;1;Kota Bandung
PPLUS lampu Sunset  Projie/lampu led kamar/lampu led kamar estetik//promo elektronik termurah cable lamp projector  white Usb - SUNSET LAMPU;45000;90000;50;1;Kab. Tangerang
AZKO Krisbow 6 inci Exhaust Fan Dengan Motion Sensor Kipas Hexos Ventilasi Fan Ventilation Peralatan Elektronik Air Ventilator;399900;399900;0;4;Kota Administrasi Jakarta Pusat
KARTU BRIZZI KARTU ELEKTRONIK KARTU BUS KARTU BANDARA KARTU E TOLL;48000;48000;0;6;Kota Banjarmasin
Selenoid Valve Katup Keran Elektronik Otomatis Mesin Air RO Dispenser;100000;100000;0;8;Kota Tangerang Selatan
BOX ELEKTRONIK X2 KOTAK RANGKAIAN ARDUINO 11.5x5.5x4 CASING BLACK BOX;6500;6500;0;27;Kota Bandung
Aplikasi Surat Menyurat Elektronik (e-surat) Untuk Perusahaan / Dinas;4000000;4000000;0;100;Jakarta Selatan
My.L CUSTOM - Map Sertifikat Tanah Elektronik, Map Sertipikat F4 Folio Nama Notaris PPAT BPN - Minimal 25pcs+;21300;21300;0;30;Kab. Bandung
Pop It Elektronik Mainan Anak Game POP IT ELEKTRIK Musik Puzzle Anak 200 Levels Gen 2 & 3 - 513 Kuromi;28800;48800;41;107;Kota Tangerang
Ace Kris Kipas Angin Berdiri Ftc3-M Standing Fan Penyejuk Ruangan Kipas Lantai Elektronik Rumah Tangga;869000;869000;0;208;Jakarta Selatan
TIMER MICROWAVE OVEN ELEKTRONIK 2 PIN 60 MENIT (WTA-3001);71000;71000;0;126;Kab. Tangerang
Elektronik indoor Modul pcb AC LG Inverter EBR81899802;485000;485000;0;11;Kota Denpasar
Tone control stereo plus meddle transistor mitra sound modul elektronik original;47500;57500;17;100;Jakarta Barat
Karet Kaki Box Elektronik Ampli Transparant + Skrup - MERAH;2800;2800;0;49;Kab. Bekasi
Tongkat E-Toll Tongkat Kartu Elektronik Toll GTO - Kuning;3500;3500;0;100;Jakarta Pusat
ALAT PENGCONGKEL PENCONGKEL PERALATAN ELEKTRONIK DAN GADGET 3PCS;49900;49900;0;43;Jakarta Barat
Obeng Set 115 In 1 Tool Kit Set Kotak Reparasi Service HP Kamera PC Laptop Jam Tangan Elektronik;54200;54200;0;989;Kota Administrasi Jakarta Barat
TIMAH GULUNG SOLDER 10METER 60/40 0.8MM Tenol Elektronik - 10M;15250;15250;0;826;Jakarta Utara
ballast trafo elektronik cdmt 70w 35w philips;100000;100000;0;6;Jakarta Pusat
box casing chassis amplifier ps plat besi pemancar fm radio elektronik;270000;270000;0;20;Kab. Tangerang
Kabel Power / Power Cable PS2 PS3 Multi Fungsi Elektronik High Quality;14900;14900;0;99951;Kota Bandung
Ballast Elektronik TL-D 18w 36w PHILIPS EB-C EBC 1x18 1x36 Travo Balas - 36w;62000;62000;0;75;Jakarta Pusat
Jack Konektor DC Baut Male Cowok Buat CCTV Dan Semua Alat Elektronik;900;900;0;540;Kota Bogor
AZKO Krisbow Mesin Absensi Elektronik Tr-6100;2149000;2149000;0;2;Kota Administrasi Jakarta Barat
Mainan Elektronik Pesawat Rakitan Mesin Dinamo;18320;18320;0;97;Jakarta Barat
kotak mini 40x20x11mm box black project diy rakitan elektronik;4600;4600;0;480;Jakarta Barat
TEKIRO Kunci L Set Elektronik Set 7 Pcs Set Kunci L Elektronik Mini Isi 7 pcs Jam / Handphone / Notebook - Vanadium Electro Hex Key;31807;39758;20;2950;Kota Depok
BATERAI ELEKTRONIK UNIVERSAL 401515 15MM X 15MM 400MAH TEBAL 4MM MANTUL HARGA PABRIK;25000;25000;0;99752;Jakarta Barat
Box Rem 2, Box Elektronik Mini 2 kuping 4,4 X 3 X 2,5 CM;1950;1950;0;7081;Jakarta Barat
100 pcs baut M3 X 50 baut elektronik kepala bulat JP, panjang 5cm;15000;15000;0;66;Kota Surabaya
BOX HITAMUNIVERSAL X8 4 SISI 16X14X4CM KOTAK ELEKTRONIK RANGKAIAN;18000;18000;0;46;Kota Bandung
Sarung Tangan Elektronik Assembly Statis Polyurethane Palm Fit Proyek - XL;8200;8200;0;3;Kota Bekasi
Megacool Megacools Contact Cleaner Pembersih Elektrik Elektronik 06257;35750;35750;0;346;Kab. Bekasi
e-Money Mandiri edisi Nataru X Tahilalats Special Edition New Year NFC Kartu Elektronik Cetakan Poster - Snowman;79999;79999;0;2;Kota Depok
DC 24V Solenoid Valve 24V Keran Elektronik - 1/2 0.5 INCH;58000;58000;0;6;Kab. Sleman
Baterai RC,Elektronik,Speaker,dll 2X 18650 3.7V 4000mAhSoket LOSI 2pin;40750;40750;0;299;Jakarta Pusat
NVMEE Hair Dryer LUNA Pengering Rambut Hairdryer Low Watt & Strong Wind NUANSA ELEKTRONIK SURABAYA - Sky;320000;320000;0;6;Kota Surabaya
Custom Uang elektronik - buat naik Transportasi Umum - Flazz, 1 SISI;75000;115000;35;493;Kota Administrasi Jakarta Selatan
Lem LCD HP Smartphone Android Lem Elektronik 15ml;18000;18000;0;26;Kota Tangerang Selatan
【Stok lokal】Rêfill empty ŘĔĽ Pǒds Pro 1pcs or 3pcs【Pengiriman pada hari】【Audio, Kamera & Elektronik Lainnya】-COD 5 - 1pcs;20000;20000;0;8;Jakarta Barat
ballast trafo elektronik philips HF-S 136 TL-D II;39500;39500;0;63;Jakarta Pusat
WHACK A MOLE ELEKTRONIK GAMEPAD SHAPE fidget press raja pencetan (CLS) - WG-Unicorn;26900;26900;0;37;Kota Administrasi Jakarta Utara
Modul/pcb/elektronik indoor AC LG Plasma;175000;175000;0;45;Kota Denpasar
KIPAS ANGIN BERDIRI YASAKA 16 INCH/STAND FAN 16 INCH/KIPAS MURAH/elektronik/kipas angin;335000;335000;0;369;Jakarta Selatan
IMPORT Joyoung L3-C61 Blender Korea Modern Alat Elektronik Mixer Chopper - L3-C61;475300;490000;3;12;Jakarta Barat
Elektronik indoor Pcb Modul AC Midea Sharp Cina Sanken;349000;349000;0;5;Kota Denpasar
"ANDROID TV 40 INCH TOSHIBA 40E35NP smart tv 40"" Toshiba 40E35 Digital";2895000;2895000;0;15;Jakarta Selatan
Elektronik indoor Pcb Modul AC Midea Sharp Cina Sanken;349000;349000;0;5;Kota Denpasar
Kipas Angin Berdiri/Stand Fan Cosmos 16 SAE;267900;267900;0;3;Jakarta Barat
"ANDROID TV 40 INCH TOSHIBA 40E35NP smart tv 40"" Toshiba 40E35 Digital";2895000;2895000;0;15;Jakarta Selatan
POLYTRON TV LED 32CV1869 SMART DIGITAL 32INCH;1925000;1925000;0;2;Kota Bekasi
COOCAA LED SMART TV 40 inch 40S3U | Digital TV Bezeless Design - INSTANT GOSEND;2399000;2399000;0;89;Kota Surabaya
Kotak Organizer Penyimpanan Kabel dan Aksesoris Elektronik Ecoco;90000;90000;0;41;Kota Administrasi Jakarta Barat
ELEKTRONIK PEST REJECT ULTRASONIC / ALAT PEMBASMI SERANGGA TIKUS NYAMU;19700;19700;0;768;Kota Medan
ballast elektronik t5 QTZ5 2x28W QTZ5 2x28 / 220-240;145000;145000;0;105;Jakarta Barat
Kris 2.4 ltr Air Fryer - Hitam Alat Masak Goreng Pembuat Makanan Penggoreng Tanpa Minyak Elektronik Dapur;525000;655000;20;266;Kota Bekasi
Tongkat E-Toll Tongkat Kartu Elektronik Pegangan Kartu EToll - Hitam;5000;5000;0;13;Kota Administrasi Jakarta Pusat
POLYTRON SMART TV PLD32CV1869 32 INCH DIGITAL TV I SMART TV POLYTRON - KIRIM INSTAN;1995000;1995000;0;10;Kota Surabaya
"LED Android Digital Google TV Polytron 32"" PLD-32RG9059";2299000;2299000;0;5;Kab. Tangerang
"Polytron Smart Lite Tv 32"" PLD 32CV2269";1849000;1849000;0;2;Kota Semarang
POLYTRON LED 40 INCH SMART TV PLD-40CV8969 / PLD 40CV8969;2699000;2699000;0;12;Jakarta Pusat
COOCAA LED SMART TV 40 inch 40S3U | Digital TV Youtube Netflix dll - INSTANT GOSEND;2399000;2399000;0;95;Kota Surabaya
Boks Kotak Koper Mini Tempat Penyimpanan Barang Elektronik Serbaguna;26900;26900;0;95;Kab. Bekasi
Obeng Set Magnetic Elektronik Hp 30 In 1;23500;23500;0;446;Kota Administrasi Jakarta Barat
Tool Kit Set S5 S-5 Murah Lengkap CADIK Pertukangan Elektronik;450000;450000;0;74;Kota Surabaya
Heat Insulation Working Mat Alas Matras Kerja Service HP Elektronik;41600;41600;0;21;Jakarta Barat
Stabilizer Toyosaki 2000 Watt Perlindungan Barang Elektronik Anda;1250000;1250000;0;1;Kota Tangerang Selatan
ELEKTRONIK KULKAS & SHOWCASE LAMPU LED KULKAS LG EAV63613209;34000;34000;0;991;Jakarta Selatan
Kunci Kombinasi Digital/Elektronik SECURAM (Digital Lock for Safes);2790000;2790000;0;1;Kota Bekasi
Miyako Kipas Angin(Stand Fan) KAS-1618 B - Rangka Plastik;267000;267000;0;5;Kota Bekasi
COOCAA LED Android Smart TV 40 Inch 40S7G | NEW Android 11 Digital TV - HARGA PROMO;2699000;2699000;0;1;Kota Surabaya
COOCAA 40Z72 40 Inch Google TV Smart TV Full HD Garansi Resmi - Instant;2659000;2659000;0;1;Kota Depok
Miyako KAS-1606X Kipas Angin - Plastik;247600;247600;0;5;Kota Bekasi
TELEVISI POLYTRON SMART LED TV 24CV1869 / 24-CV1869 | 24 inch, Smart TV - KARAWANG;1539000;1539000;0;99;Kab. Karawang
passport timbangan koper ( elektronik );179000;179000;0;99995;Kota Tangerang
Sesuai untuk(iPhone X)kasus telepon,Komponen elektronik,bahan kaca tempered, anti drop, anti slip, wear-resistant - 1, iPhone X;59000;100000;41;9;Kab. Tangerang
THERMALRIGHT AQUA ELITE 360 BLACK ARGB V2 CPU AIO Water Cooling Led Elektronik;1143700;1143700;0;3;Kota Surabaya
Baterai JAM CR927 CR 927 Lithium Battery 3V Batre Elektronik Lainnya;7000;7000;0;50;Jakarta Barat
Mesin absen elektronik Handkey II Ready stock;27500000;27500000;0;100000;Jakarta Pusat
barang cengbeng set elektronik;50000;50000;0;13;Kota Administrasi Jakarta Barat
BOX CUSTOM AKRILIK PROJECT ELEKTRONIK/BOX AMPLIFIER/BOK ARDUINO - Metode Lem;269000;269000;0;199;Jakarta Pusat
"Polytron Android TV 24"" PLD 24CV1869";1449000;1449000;0;4;Kota Semarang
COOCAA GOOGLE SMART TV 40 inch 40Z72 | Full HD, Digital TV NEW 2022/23 - HARGA PROMO;2699000;2699000;0;1;Kota Surabaya
Changhong【Google TV】CHiQ 40 inch Smart TV HDR10 Digital TV ( L40G7P Pro );2699000;2699000;0;16;Jakarta Utara
Miyako Kipas Angin(Stand Fan/Desk Fan) KAS-1627 KB;360052;367400;2;3;Kota Bekasi
"Polytron Smart TV 40"" PLD 40CV8969";2675000;2675000;0;3;Kota Semarang
AQUA Elektronik TV AQT65S80EUX - 4K HDR - Google TV - Bezel Less - RAM 2GB ROM 32GB - Digital TV;9099000;10180000;11;9;Kota Administrasi Jakarta Utara
TJAP MATA / CAP MATA Tang / Plier Elektronik 5 INC (Mini) - KNIP;40000;40000;0;44;Kota Administrasi Jakarta Pusat
Kantong Plastik Anti Statis 15x20 cm Komponen Elektronik;5000;5000;0;318;Kota Tangerang
Baterai Speaker Dan Elektronik 18X 18650 12000mAh 12V BMS 3S 60A BLOK;355750;385000;8;1999;Kota Administrasi Jakarta Pusat
Box Rakit Perangkat Elektronik Hitam Plastik X1 X3 X 1 X 3 Electronic Merakit Perakit Komponen - X1;4043;4043;0;2;Kota Serang
Kotak Proyek Elektronik Instrumen Electronic Box 200x175x70 mm Hitam;120000;120000;0;1;Kota Bandung
Tang Plato pemotong kawat serbaguna gunting alat potong kabel wire cutter cable elemet elektronik mulifungsi mudah penggunaan;9800;25000;61;9971;Kota Administrasi Jakarta Pusat
CDI Digital Shogun 125, GL, Mega Pro Pengapian Elektronik Elektrical Unit sepeda motor;76000;76000;0;70;Kota Surabaya
KABEL MINI HDMI TO HDMI 1.5M (UTK TABLET / GADGET / ELEKTRONIK LAIN);14500;14500;0;7354;Kota Administrasi Jakarta Barat
